author,description,publishedAt,source,title,url,urlToImage,category,scraping_date
Weizhen Tan,"Former White House chief strategist Steve Bannon has proposed a plan to allies in Congress and senior White House aides to end the probe into Russian interference in the 2016 presidential elections, The Washington Post reported.",2018-04-12T02:57:17Z,cnbc,Steve Bannon is reportedly pushing a plan to thwart the Mueller investigation,https://www.cnbc.com/2018/04/11/mueller-investigation-bannon-makes-plan-to-end-probe-protect-trump.html,https://fm.cnbc.com/applications/cnbc.com/resources/img/editorial/2018/01/17/104950123-GettyImages-905565976.1910x1000.jpg,business,2018-04-12 01:45:11.497061
John Harwood,"Ryan's announcement will dispirit fellow Republicans, diminish his ability to raise campaign funds and encourage more vulnerable incumbents to retire, CNBC's John Harwood writes.",2018-04-11T16:39:40Z,cnbc,Paul Ryan's retirement increases the odds that President Trump will be impeached,https://www.cnbc.com/2018/04/11/paul-ryans-retirement-makes-president-trump-impeachment-more-likely.html,https://fm.cnbc.com/applications/cnbc.com/resources/img/editorial/2018/04/11/105124680-GettyImages-944719488.1910x1000.jpg,business,2018-04-12 01:45:11.497061
Michelle Fox,"The latest trade move by China was “very positive,” but that doesn’t necessarily mean that tariffs won’t happen before negotiations occur, top Trump economic advisor Larry Kudlow says.",2018-04-11T21:22:25Z,cnbc,Trump economic advisor Larry Kudlow: Tariffs might come before negotiations with China,https://www.cnbc.com/2018/04/11/trump-economic-advisor-larry-kudlow-tariffs-might-come-before-negotiations-with-china.html,https://fm.cnbc.com/applications/cnbc.com/resources/img/editorial/2018/04/09/105118577-RTX5I5RC.1910x1000.jpg,business,2018-04-12 01:45:11.497061
Yen Nee Lee,"Shayne Elliott, the CEO of ANZ bank, discusses the U.S.-China trade tensions and Australia's Royal Commission inquiry into the banking sector.",2018-04-12T00:31:13Z,cnbc,The CEO of a major Australian bank explains why he isn't worried about global trade disintegrating,https://www.cnbc.com/2018/04/11/anz-ceo-shayne-elliott-on-potential-impacts-of-a-trade-war.html,https://fm.cnbc.com/applications/cnbc.com/resources/img/editorial/2016/03/17/103477946-GettyImages-463205098.1910x1000.jpg,business,2018-04-12 01:45:11.497061
Jordan Novet,Zuora on Wednesday priced its initial public offering above the range it provided one day earlier.,2018-04-12T02:47:31Z,cnbc,Zuora prices IPO at $14 per share — valuing the company at $1.44 billion,https://www.cnbc.com/2018/04/11/zuora-prices-ipo-at-14-per-share--valuing-the-company-at-1-point-44-billion.html,https://fm.cnbc.com/applications/cnbc.com/resources/img/editorial/2014/05/28/101710845-443697588_640.1910x1000.jpg,business,2018-04-12 01:45:11.497061
Reuters,"In response to a suspected chemical attack in Syria, Trump tweeted on Wednesday that missiles ""will be coming"" and Russia should ""get ready.""",2018-04-11T20:47:05Z,cnbc,Trump has not laid out timetable for Syria attack response: White House,https://www.cnbc.com/2018/04/11/trump-has-not-laid-out-timetable-for-syria-attack-response-white-house.html,https://fm.cnbc.com/applications/cnbc.com/resources/img/editorial/2018/04/11/105125423-GettyImages-944704956.1910x1000.jpg,business,2018-04-12 01:45:11.497061
Nyshka Chandran,"North Korea's concept of denuclearization ""bears no resemblance to the American definition,"" said Evans J.R. Revere of Washington-based think tank Brookings.",2018-04-12T04:34:30Z,cnbc,'Denuclearization' likely means different things to Trump and Kim Jong Un,https://www.cnbc.com/2018/04/12/us-and-north-korea-have-different-definitions-of-denuclearization.html,https://fm.cnbc.com/applications/cnbc.com/resources/img/editorial/2017/12/19/104907144-RTX3QEC6-kim-jong-un.1910x1000.jpg,business,2018-04-12 01:45:11.497061
"Jeremy Herb and Manu Raju, CNN",The latest fight between congressional Republicans and the Justice Department over FBI documents has Republicans threatening to hold Deputy Attorney General Rod Rosenstein in contempt of Congress -- and openly floating the notion of impeaching him -- which could provide a new pretext for President Donald Trump to potentially fire Rosenstein himself.,2018-04-11T20:46:36Z,cnn,House GOP targets Rosenstein as Trump weighs his firing,http://us.cnn.com/2018/04/11/politics/rod-rosenstein-house-republicans-nunes/index.html,https://cdn.cnn.com/cnnnext/dam/assets/171204082138-mobapp-nunes-rosenstein-wray-split-super-tease.jpg,general,2018-04-12 01:45:11.497061
"Laura Jarrett, CNN",Only one person at the Justice Department has the ability to stop special counsel Robert Mueller's Russia investigation. But what happens if that person is fired?,2018-04-12T00:30:23Z,cnn,Who would be Mueller's boss if Rosenstein goes?,http://us.cnn.com/2018/04/11/politics/rod-rosenstein-doj-succession-plan/index.html,https://cdn.cnn.com/cnnnext/dam/assets/180410162928-02-rod-rosenstein-lead-image-super-tease.jpg,general,2018-04-12 01:45:11.497061
Eli Watkins,"Steve Bannon, President Donald Trump's former chief strategist, is trying to pitch a Russia probe response strategy to White House aides and congressional allies despite Trump's dismissal of him, The Washington Post reported Wednesday.",2018-04-12T02:00:10Z,cnn,WaPo: Bannon pitching plan to WH on what Trump should do in Russia probe,http://us.cnn.com/2018/04/11/politics/steve-bannon-donald-trump-russia/index.html,https://cdn.cnn.com/cnnnext/dam/assets/180320114650-steve-bannon-0306-super-tease.jpg,general,2018-04-12 01:45:11.497061
"Analysis by Chris Cillizza, CNN Editor-at-large",Donald Trump wants to fire someone.,2018-04-11T16:41:18Z,cnn,"For Donald Trump, firing Rod Rosenstein might be just the thing",http://us.cnn.com/2018/04/11/politics/trump-rosenstein-mueller-firing/index.html,https://cdn.cnn.com/cnnnext/dam/assets/180131150359-02-rosenstein-trump-split-super-tease.jpg,general,2018-04-12 01:45:11.497061
Fred Wertheimer and Norm Eisen,"Firing Deputy Attorney General Rod Rosenstein or special counsel Robert Mueller would cross a red line, indicating that President Donald Trump thinks he is above the law, and Congress would urgently need to step in to preserve the investigation, Fred Wertheimer and Norm Eisen say.",2018-04-11T12:13:40Z,cnn,Firing Rosenstein would cross a red line for the rule of law,http://us.cnn.com/2018/04/11/opinions/firing-rosenstein-would-cross-red-line-wertheimer-eisen/index.html,https://cdn.cnn.com/cnnnext/dam/assets/180129142428-01-rosenstein-trump-split-super-tease.jpg,general,2018-04-12 01:45:11.497061
Dylan Byers,Mark Zuckerberg spent more than 10 hours testifying before Congress this week and still didn't answer the most important question about Facebook: How much data does Facebook collect on users -- and non-users?,2018-04-11T11:04:44Z,cnn,Why Mark Zuckerberg didn't want to talk about your data,http://money.cnn.com/2018/04/11/technology/faebook-zuckerberg-data/index.html,http://i2.cdn.turner.com/money/dam/assets/180411113650-zuckerberg-hearing-041118-780x439.jpg,general,2018-04-12 01:45:11.497061
"Gloria Borger and Shimon Prokupecz, CNN","FBI agents who raided the home, office and hotel of Donald Trump's personal lawyer sought communications that Trump had with attorney Michael Cohen and others regarding the infamous ""Access Hollywood"" tape that captured Trump making lewd remarks about women a month before the election, according to sources familiar with the matter.",2018-04-11T21:06:52Z,cnn,FBI sought Trump's communications with his personal lawyer regarding Access Hollywood,http://us.cnn.com/2018/04/11/politics/access-hollywood-trump-lawyer-communications/index.html,https://cdn.cnn.com/cnnnext/dam/assets/161007173925-trump-wapo-access-hollywood-2-super-tease.jpg,general,2018-04-12 01:45:11.497061
"Analysis By Chris Cillizza, CNN Editor-at-large","When FBI agents raided Michael Cohen's office and home on Monday, they were looking for -- among other things -- any documents related to the ""Access Hollywood"" tape that nearly ended Donald Trump's campaign back in the fall of 2016.",2018-04-11T23:32:30Z,cnn,3 things we want to know about Michael Cohen and the 'Access Hollywood' tape,http://us.cnn.com/2018/04/11/politics/access-hollywood-michael-cohen-tape-analysis/index.html,https://cdn.cnn.com/cnnnext/dam/assets/161007173720-trump-wapo-access-hollywood-1-super-tease.jpg,general,2018-04-12 01:45:11.497061
By Mark Duell,The boy had become entangled in the drier in a caravan after trying to climb into it at the site at Eastchurch on the Isle of Sheppey in Kent.,2018-04-12T02:37:47+00:00,daily-mail,"Boy, three, had arm ripped off when he climbed into tumble drier",http://www.dailymail.co.uk/news/article-5603537/Boy-three-one-arms-ripped-climbed-tumble-drier-holiday-park.html,http://i.dailymail.co.uk/i/newpix/2018/04/11/14/4B0C002100000578-0-image-a-136_1523453455507.jpg,entertainment,2018-04-12 01:45:11.497061
By Jack Doyle Executive Political Editor For The Daily Mail,"Jeremy Corbyn will say that young people ‘deserve a break’ and the offer will allow them to ‘travel to work, to study and to visit friends’.",2018-04-12T02:32:00+00:00,daily-mail,Labour will pledge to offer the under-25s free bus travel,http://www.dailymail.co.uk/news/article-5605783/Labour-try-woo-young-voters-pledge-offer-25s-free-bus-travel.html,http://i.dailymail.co.uk/i/newpix/2018/04/12/01/4AFAE67500000578-0-image-a-25_1523493778460.jpg,entertainment,2018-04-12 01:45:11.497061
By Iain Burns For Mailonline,"El Shafee Elsheikh (pictured), 29, who is being held by Kurdish fighters in Syria with fellow Beatle Alexanda Kotey, 34, was interviewed by CNN's Nick Paton Walsh.",2018-04-12T02:18:57+00:00,daily-mail,"'Beatle' says he regrets letting son, 4, watch video of pilot's murder",http://www.dailymail.co.uk/news/article-5605713/ISIS-Beatle-says-regrets-letting-son-four-watch-video-pilot-burned-alive.html,http://i.dailymail.co.uk/i/newpix/2018/04/12/01/4AF27C8800000578-0-image-a-14_1523494721486.jpg,entertainment,2018-04-12 01:45:11.497061
By Dailymail.com Reporter,Tech mogul Bill Gates and actress-turned-humanitarian Angelina Jolie have been named the most admired man and woman in the world in a survey compiled by You Gov.,2018-04-12T02:06:58+00:00,daily-mail,Angelina Jolie and Bill Gates are the world's most admired people,http://www.dailymail.co.uk/news/article-5604561/Angelina-Jolie-Bill-Gates-worlds-admired-people.html,http://i.dailymail.co.uk/i/newpix/2018/04/11/19/4B0E599800000578-0-image-a-65_1523472231864.jpg,entertainment,2018-04-12 01:45:11.497061
"By Laura Collins In Norristown, Pennsylvania For Dailymail.com","In the midst of testifying in Bill Cosby's sexual assault retrial in Norristown, Pennsylvania, Chelan Lasha (top right) turned to address the comedian with an emotionally charged comment.",2018-04-12T01:59:32+00:00,daily-mail,Cosby is unfazed as second of five accusers addresses him directly,http://www.dailymail.co.uk/news/article-5604019/Cosby-unfazed-second-five-accusers-testifying-retrial-addresses-directly.html,http://i.dailymail.co.uk/i/newpix/2018/04/11/19/4B0E43A700000578-0-image-a-73_1523470929725.jpg,entertainment,2018-04-12 01:45:11.497061
By Iain Burns For Mailonline,"Fars quoted Arabic news channel al-Mayadeen's Moscow correspondent, who said British troops were captured after 'infiltrating' Syria, however the MoD today insisted the report was untrue",2018-04-12T01:29:22+00:00,daily-mail,"British forces soldiers 'captured in Syria', Iran news agency reports",http://www.dailymail.co.uk/news/article-5605357/British-special-forces-soldiers-captured-Syria-Irans-official-news-agency-reports.html,http://i.dailymail.co.uk/i/newpix/2018/04/11/23/4AF17B9F00000578-0-image-a-3_1523484393136.jpg,entertainment,2018-04-12 01:45:11.497061
By Eve Buckland For Mailonline,"Stars of ITV's The Real Full Monty: Ladies Night were reportedly paid £10,000 each to perform in the show.",2018-04-12T01:24:54+00:00,daily-mail,The Real Full Monty: Ladies Night stars 'paid £10K each',http://www.dailymail.co.uk/tvshowbiz/article-5605485/The-Real-Monty-Ladies-Night-stars-paid-10K-ITV.html,http://i.dailymail.co.uk/i/newpix/2018/04/11/23/4B0F877D00000578-0-image-a-70_1523485817146.jpg,entertainment,2018-04-12 01:45:11.497061
By Daniel Martin Policy Editor For The Daily Mail,Latest figures show that one in 10 people with a previous conviction for knife possession received a sentence other than immediate custody.,2018-04-12T01:01:45+00:00,daily-mail,"Knife crime farce: 2,000 offenders a year are dodging jail",http://www.dailymail.co.uk/news/article-5605829/Knife-crime-farce-2-000-offenders-year-dodging-jail-despite-two-strikes-rule.html,http://i.dailymail.co.uk/i/newpix/2018/04/12/02/4B10445E00000578-0-image-a-47_1523494876241.jpg,entertainment,2018-04-12 01:45:11.497061
By Alexander Robertson For Mailonline,The daughter of Russian spy Sergei Skripal said her father was still 'seriously ill' in hospital as she said she was still suffering from the effects of the nerve gas attack in Salisbury last month.,2018-04-12T01:01:17+00:00,daily-mail,Yulia Skripal says she does 'NOT want Russian Embassy help',http://www.dailymail.co.uk/news/article-5604913/Yulia-Skripal-says-does-NOT-want-Russian-Embassy-help.html,http://i.dailymail.co.uk/i/newpix/2018/04/11/20/4B0E99FE00000578-0-image-a-12_1523475062006.jpg,entertainment,2018-04-12 01:45:11.497061
By Chris Greenwood Chief Crime Correspondent For The Daily Mail,Scotland Yard said detectives have nothing left to pursue unless handed fresh information about the 1993 case of the murder of Stephen Lawrence in south east London.,2018-04-12T01:00:52+00:00,daily-mail,Metropolitan Police to close Stephen Lawrence murder case,http://www.dailymail.co.uk/news/article-5605287/Metropolitan-Police-close-Stephen-Lawrence-murder-case.html,http://i.dailymail.co.uk/i/newpix/2018/04/11/22/4B0EBAA600000578-0-image-a-102_1523483070004.jpg,entertainment,2018-04-12 01:45:11.497061
Mallory Locklear,Most lawmakers weren’t prepared to ask the right questions.,2018-04-11T20:44:00Z,engadget,The Zuckerberg hearings were a wasted opportunity,https://www.engadget.com/2018/04/11/zuckerberg-hearings-wasted-opportunity/,https://o.aolcdn.com/images/dims?thumbnail=1200%2C630&quality=80&image_uri=https%3A%2F%2Fo.aolcdn.com%2Fimages%2Fdims%3Fcrop%3D5000%252C3334%252C0%252C0%26quality%3D85%26format%3Djpg%26resize%3D1600%252C1067%26image_uri%3Dhttp%253A%252F%252Fo.aolcdn.com%252Fhss%252Fstorage%252Fmidas%252F6f7bb2c85caa795d983722bd086ee48f%252F206288668%252Fmark-zuckerberg-chief-executive-officer-and-founder-of-facebook-inc-picture-id944799036%26client%3Da1acac3e1b3290917d92%26signature%3Dfedc18bd29ef2cb4c74bf324548dc9597f823297&client=cbc79c14efcebee57402&signature=81c33f1bbc5b33def6392e8218f8e4eac2be4347,technology,2018-04-12 01:45:11.497061
Steve Dent,Satellite company PlanetLabs released some astonishing side shots of Earth.,2018-04-11T14:15:00Z,engadget,Side view satellite images turn the Earth into 'Sim City',https://www.engadget.com/2018/04/11/side-view-satellite-images-turn-the-earth-into-sim-city/,https://o.aolcdn.com/images/dims?thumbnail=1200%2C630&quality=80&image_uri=https%3A%2F%2Fs.aolcdn.com%2Fhss%2Fstorage%2Fmidas%2F34754bf1aa790270bd3778228a491c9e%2F206284942%2Fdohar-planet-labs-2018-04-10-01.jpg&client=cbc79c14efcebee57402&signature=4ab05a4894980baa463b3e8882463a25208fadaa,technology,2018-04-12 01:45:11.497061
Mallory Locklear,Bundle Spotify Premium and Hulu Limited Commercials plans for a reduced price.,2018-04-11T14:01:00Z,engadget,Hulu and Spotify bundle will only cost you $13 a month,https://www.engadget.com/2018/04/11/hulu-spotify-bundle-cost-13-a-month/,https://o.aolcdn.com/images/dims?thumbnail=1200%2C630&quality=80&image_uri=https%3A%2F%2Fo.aolcdn.com%2Fimages%2Fdims%3Fcrop%3D7360%252C4912%252C0%252C0%26quality%3D85%26format%3Djpg%26resize%3D1600%252C1068%26image_uri%3Dhttp%253A%252F%252Fo.aolcdn.com%252Fhss%252Fstorage%252Fmidas%252Ff207cc94b18134545d2dcfe3f32c8c81%252F206238836%252Fspotify-on-iphone-6-picture-id842820890%26client%3Da1acac3e1b3290917d92%26signature%3D995cd5679030dc52865f34a8c2b6a52bc5638858&client=cbc79c14efcebee57402&signature=02efd5856e5a2797fb663ef8a6e9cab0b4b0e1d3,technology,2018-04-12 01:45:11.497061
Mallory Locklear,Many are concerned the law will lead to online censorship.,2018-04-11T16:16:00Z,engadget,Trump signs controversial FOSTA-SESTA bill into law,https://www.engadget.com/2018/04/11/trump-signs-fosta-sesta-bill-into-law/,https://o.aolcdn.com/images/dims?thumbnail=1200%2C630&quality=80&image_uri=https%3A%2F%2Fs.aolcdn.com%2Fhss%2Fstorage%2Fmidas%2F3daf78d4fc2c0adce114d14f110f28a2%2F206288396%2Ftrump-ed.jpg&client=cbc79c14efcebee57402&signature=d34b5d1d80cbc36a8b1c062283c97689641e87bb,technology,2018-04-12 01:45:11.497061
Swapna Krishna,Get ready for an all-new look for Gmail on the web.,2018-04-11T16:12:00Z,engadget,Google plans redesign for Gmail on the web,https://www.engadget.com/2018/04/11/google-gmail-web-redesign/,https://o.aolcdn.com/images/dims?thumbnail=1200%2C630&quality=80&image_uri=https%3A%2F%2Fo.aolcdn.com%2Fimages%2Fdims%3Fcrop%3D6000%252C4000%252C0%252C0%26quality%3D85%26format%3Djpg%26resize%3D1600%252C1067%26image_uri%3Dhttp%253A%252F%252Fo.aolcdn.com%252Fhss%252Fstorage%252Fmidas%252F71ad3c85757a0f7141262856ecec5b25%252F205974010%252Fwoman-using-an-macbook-pro-as-she-uses-google-gmail-on-november-27-picture-id881503284%26client%3Da1acac3e1b3290917d92%26signature%3D8ad709053c2bb4373836171578a83165e2bcf64d&client=cbc79c14efcebee57402&signature=7c2281e4f42f895e27b6e9e76a122ec5f5de1ac7,technology,2018-04-12 01:45:11.497061
Dalton Ross,,2018-04-12T04:01:58Z,entertainment-weekly,‘Survivor’: Jeff Probst breaks down the epic Chris–Domenick feud,http://ew.com/tv/2018/04/12/survivor-jeff-probst-chris-dom-ghost-island-episode-8/,http://ewedit.files.wordpress.com/2018/01/110483_13790b.jpg?crop=0px%2C24px%2C2700px%2C1418px&resize=1200%2C630,entertainment,2018-04-12 01:45:11.497061
Jodi Walker,,2018-04-12T03:55:55Z,entertainment-weekly,<em>The Blacklist</em> recap: 'Zarak Mosadek',http://ew.com/recap/the-blacklist-season-5-episode-18/,https://ewedit.files.wordpress.com/2018/04/nup_181770_0423.jpg?crop=0px%2C0px%2C2700px%2C1417.5px&resize=1200%2C630,entertainment,2018-04-12 01:45:11.497061
Anthony Breznican,,2018-04-12T03:07:02Z,entertainment-weekly,<em>The Americans</em> recap: 'Urban Transport Planning',http://ew.com/recap/the-americans-season-6-episode-3/,https://ewedit.files.wordpress.com/2018/04/dsc313731-copy.jpg?crop=0px%2C129px%2C2700px%2C1419px&resize=1200%2C630,entertainment,2018-04-12 01:45:11.497061
Oliver Gettell,,2018-04-12T02:24:02Z,entertainment-weekly,Late-night hosts go off on Paul Ryan not seeking re-election,http://ew.com/tv/2018/04/11/late-night-paul-ryan-not-seeking-re-election/,https://ewedit.files.wordpress.com/2018/04/daily-show-paul-ryan.jpg?crop=0px%2C0px%2C2700px%2C1417.5px&resize=1200%2C630,entertainment,2018-04-12 01:45:11.497061
Chancellor Agard,,2018-04-12T02:05:15Z,entertainment-weekly,<em>Suits</em> recap: 'Inevitable',http://ew.com/recap/suits-season-7-episode-13/,https://ewedit.files.wordpress.com/2018/04/nup_180194_0090.jpg?crop=0px%2C0px%2C2700px%2C1417.5px&resize=1200%2C630,entertainment,2018-04-12 01:45:11.497061
Patrick Gomez,,2018-04-12T01:00:56Z,entertainment-weekly,'Empire' recap: 'Sweet Sorrow',http://ew.com/recap/empire-season-4-episode-12/,https://ewedit.files.wordpress.com/2018/04/ffemp-s4_412-sc32-ch_0715_hires2.jpg?crop=0px%2C0px%2C2700px%2C1417.5px&resize=1200%2C630,entertainment,2018-04-12 01:45:11.497061
Dalton Ross,,2018-04-12T01:00:47Z,entertainment-weekly,<em>Survivor: Ghost Island</em> recap: 'Fear Keeps You Sharp',http://ew.com/recap/survivor-season-36-episode-8/,https://ewedit.files.wordpress.com/2018/04/110483_28299b.jpg?crop=0px%2C340px%2C2700px%2C1419px&resize=1200%2C630,entertainment,2018-04-12 01:45:11.497061
Natalie Abrams,,2018-04-12T01:00:22Z,entertainment-weekly,"<em>The Blacklist</em> reveals Red's daughter — yes, another one",http://ew.com/tv/2018/04/11/blacklist-red-daughter/,https://ewedit.files.wordpress.com/2018/04/nup_181773_0124.jpg?crop=0px%2C0px%2C2700px%2C1417.5px&resize=1200%2C630,entertainment,2018-04-12 01:45:11.497061
Breanne L. Heldman,,2018-04-12T00:56:42Z,entertainment-weekly,Joshua Jackson and Lauren Ridloff shine in Broadway's uneven <em>Children of a Lesser God</em> revival: EW review,http://ew.com/theater/2018/04/11/children-of-a-lesser-god-revival-review/,https://ewedit.files.wordpress.com/2018/04/coalg_setups_s_5091_edit_v003.jpg?crop=0px%2C0px%2C2700px%2C1417.5px&resize=1200%2C630,entertainment,2018-04-12 01:45:11.497061
Derek Lawrence,,2018-04-11T23:34:37Z,entertainment-weekly,<em>Roseanne</em> star Emma Kenney to seek treatment for her 'battles',http://ew.com/tv/2018/04/11/roseanne-emma-kenney-seeking-treatment/,https://ewedit.files.wordpress.com/2018/04/emma-kenny.jpg?crop=0px%2C0px%2C1762px%2C925.05px&resize=1200%2C630,entertainment,2018-04-12 01:45:11.497061
Nick FriedellESPN Staff Writer ,"It came down to the last night of the season, but Minnesota claimed the West's final playoff spot, sending Denver packing and qualifying for the postseason for the first time since 2004.",2018-04-12T01:17:03Z,espn,Timberwolves beat Nuggets in OT to end 14-year playoff drought,http://espn.go.com/nba/story/_/id/23123183/timberwolves-beat-nuggets-ot-end-14-year-playoff-drought,http://a.espncdn.com/combiner/i?img=%2Fphoto%2F2018%2F0411%2Fr355161_1296x729_16%2D9.jpg,sports,2018-04-12 01:45:11.497061
David SchoenfieldESPN Senior Writer ,Scrums between the Red Sox and Yankees and the Rockies and Padres go to show it's never too early in the year to add grudges between division rivals.,2018-04-12T04:35:31Z,espn,Real or Not? Bad blood brewing after Wednesday's bevy of brawls,http://espn.go.com/blog/sweetspot/post/_/id/85790/real-or-not-bad-blood-brewing-after-wednesdays-bevy-of-brawls,http://a1.espncdn.com/combiner/i?img=%2Fphoto%2F2018%2F0411%2Fr355248_1296x729_16%2D9.jpg,sports,2018-04-12 01:45:11.497061
Kevin ArnovitzESPN Staff Writer ,The almost dynasty: Inside the yearslong sinking of the superteam formerly known as the Los Angeles Clippers.,2018-04-11T11:00:00Z,espn,Did Doc Rivers make the Clippers -- or break them?,http://espn.go.com/nba/story/_/id/23092424/nba-did-doc-rivers-make-los-angeles-clippers-break-them,http://a3.espncdn.com/combiner/i?img=%2Fphoto%2F2018%2F0410%2Fr354346_1296x729_16%2D9.jpg,sports,2018-04-12 01:45:11.497061
Football Italia Staff,"As Juventus came within seconds of emulating Roma&rsquo;s Champions League &lsquo;remontada&rsquo;, ultimately going out to a Real Madrid penalty, Football Italia rates the efforts of those in Bianconero&hellip;",2018-04-11T01:00:00Z,football-italia,Player Ratings: Madrid 1-3 Juve,http://www.football-italia.net/node/119800,https://www.football-italia.net/sites/default/files/imagecache/main_photo/[type]/[nid]/Mandzukic-1804-RMA-Navas-epa_0.jpg,sports,2018-04-12 01:45:11.497061
Football Italia Staff,Gigi Buffon said the referee was completely out of his depth in Real Madrid-Juventus and should &ldquo;sit in the stands eating crisps.&rdquo;,2018-04-11T01:00:00Z,football-italia,Buffon: &#039;Ref out of his depth&#039;,http://www.football-italia.net/node/119794,https://www.football-italia.net/sites/default/files/imagecache/main_photo/[type]/[nid]/Buffon-1804-RMA-ref-epa.jpg,sports,2018-04-12 01:45:11.497061
Football Italia Staff,Juventus President Andrea Agnelli accused UEFA designator Pierluigi Collina of &ldquo;vanity&rdquo; and &ldquo;scientifically&quot; damaging Italian clubs in Europe.,2018-04-11T01:00:00Z,football-italia,Agnelli: &#039;UEFA penalise Italian clubs&#039;,http://www.football-italia.net/node/119792,https://www.football-italia.net/sites/default/files/imagecache/main_photo/[type]/[nid]/agnelli-1709-mic-epa_4.jpg,sports,2018-04-12 01:45:11.497061
Football Italia Staff,"Lucas Vazquez assures Medhi Benatia &ldquo;ran me down,&rdquo; but Juventus protests at the last-gasp Real Madrid penalty were &ldquo;normal.&rdquo;",2018-04-11T01:00:00Z,football-italia,Vazquez: &#039;Benatia ran me down&#039;,http://www.football-italia.net/119799/vazquez-benatia-ran-me-down,https://www.football-italia.net/sites/default/files/imagecache/main_photo/[type]/[nid]/Benatia-1804-RMA-pen-tw_0.jpg,sports,2018-04-12 01:45:11.497061
Football Italia Staff,Zinedine Zidane believes &ldquo;it was a penalty&rdquo; for Real Madrid and &ldquo;over the two legs we deserved to go through&rdquo; against Juventus.,2018-04-11T01:00:00Z,football-italia,Zidane: &#039;Real Madrid deserved it&#039;,http://www.football-italia.net/119798/zidane-real-madrid-deserved-it,https://www.football-italia.net/sites/default/files/imagecache/main_photo/[type]/[nid]/Zidane-1804-Allegri-epa.jpg,sports,2018-04-12 01:45:11.497061
Football Italia Staff,"Juventus captain Gigi Buffon continued his furious attack on referee Michael Oliver. &ldquo;You&rsquo;d have to be an animal to do that, have a trash can in place of a heart.&rdquo;",2018-04-11T01:00:00Z,football-italia,Buffon: &#039;Ref heartless&#039;,http://www.football-italia.net/119797/buffon-ref-heartless,https://www.football-italia.net/sites/default/files/imagecache/main_photo/[type]/[nid]/Buffon-1804-UCL-RAH-epa.jpg,sports,2018-04-12 01:45:11.497061
Football Italia Staff,Juventus defender Medhi Benatia explained why Real Madrid should not have been awarded a penalty. &ldquo;I got the ball and Lucas Vazquez just went down.&rdquo;,2018-04-11T01:00:00Z,football-italia,Benatia: &#039;It wasn&#039;t a penalty&#039;,http://www.football-italia.net/119796/benatia-it-wasnt-penalty,https://www.football-italia.net/sites/default/files/imagecache/main_photo/[type]/[nid]/Benatia-1804-RMA-pen-tw.jpg,sports,2018-04-12 01:45:11.497061
