author,description,publishedAt,source,title,url,urlToImage,category,scraping_date
http://www.abc.net.au/news/louise--yaxley/5553226,The Prime Minister stands by Australia's anti-espionage laws while conceding they are provoking tensions with China.,2018-04-12T01:54:26Z,abc-news-au,Turnbull admits there has been 'tension' with China over foreign spy laws,http://www.abc.net.au/news/2018-04-12/turnbull-concedes-tension-with-china-over-interference-laws/9643604,http://www.abc.net.au/radionational/image/8131256-16x9-700x394.jpg,general,2018-04-12 01:45:11.497061
http://www.abc.net.au/news/stan-grant/8195640,"On the campaign trial in 2016, Donald Trump said Hillary Clinton plan's for Syria would lead to World War III. Now he may have to revisit his own words.",2018-04-11T20:03:06Z,abc-news-au,Trump's 'World War III' attack is coming back to haunt him,http://www.abc.net.au/news/2018-04-12/trump-syria-response-embroils-russia-iran-israel/9642154,http://www.abc.net.au/news/image/8426724-16x9-700x394.jpg,general,2018-04-12 01:45:11.497061
http://www.abc.net.au/news/emma--younger/6455416,"The widow of a Melbourne magistrate who took his own life last month believes a crippling caseload contributed to the death of her husband, who often heard up to 90 cases a day.",2018-04-12T02:57:46Z,abc-news-au,"'Unrelenting' workload of 90 cases a day contributed to magistrate's death, widow says",http://www.abc.net.au/news/2018-04-12/stephen-myall-magistrate-unrelenting-workload/9643950,http://www.abc.net.au/news/image/9644034-16x9-700x394.jpg,general,2018-04-12 01:45:11.497061
http://www.abc.net.au/news/ashleigh-stevenson/7346884,"Three Australian 'cheats' were caught ahead of the Commonwealth Games, anti-doping authorities have revealed, after drug testers conducted a huge operation to ensure the event was clean.",2018-04-12T04:22:23Z,abc-news-au,"Three Australian 'cheats', international athletes caught doping before Games",http://www.abc.net.au/news/2018-04-12/three-australians-caught-doping-before-games/9644400,http://www.abc.net.au/news/image/9644690-16x9-700x394.jpg,general,2018-04-12 01:45:11.497061
Ariel Bogle,Facebook CEO Mark Zuckerberg survived his Washington DC appearances and now US politicians are itching to do something. But what?,2018-04-12T03:41:21Z,abc-news-au,The anti-Facebook backlash is official and regulation is 'inevitable',http://www.abc.net.au/news/science/2018-04-12/facebook-mark-zuckerberg-congress-regulation-inevitable/9636536,http://www.abc.net.au/cm/rimage/9644560-16x9-large.jpg?v=4,general,2018-04-12 01:45:11.497061
Al Jazeera,Trump says he will respond to an alleged chemical attack in Syria with missiles after Russia vowed to shoot them down.,2018-04-11T11:21:00Z,al-jazeera-english,Trump tells Russia to 'get ready' for Syria missile strikes,http://www.aljazeera.com/news/2018/04/trump-tells-russia-ready-syria-missile-strikes-180411110830819.html,https://www.aljazeera.com/mritems/Images/2015/11/19/dafe960a95f143e0887a3d704bd7b675_18.jpg,general,2018-04-12 01:45:11.497061
Al Jazeera,"Saudi air defences intercept missile fired at Riyadh, videos published on social media purportedly show.",2018-04-11T17:22:00Z,al-jazeera-english,Yemen's Houthi rebels fire ballistic missile at Saudi capital,http://www.aljazeera.com/news/2018/04/yemen-houthi-rebels-fire-ballistic-missile-saudi-capital-180411153418562.html,https://www.aljazeera.com/mritems/Images/2015/4/28/b10f30f098114de19fe3e36afa92ea14_18.jpg,general,2018-04-12 01:45:11.497061
Tamila Varshalomidze,Experts give their assessments of what comes next after US vows to carry out missile strikes against the Syrian regime.,2018-04-11T20:16:00Z,al-jazeera-english,5 things to know about the expected US strikes in Syria,http://www.aljazeera.com/news/2018/04/5-expected-strikes-syria-180411160514363.html,https://www.aljazeera.com/mritems/Images/2018/4/11/9f6e3a5df4f342128fb5b02b6dda2d6f_18.jpg,general,2018-04-12 01:45:11.497061
Maria Verza,Mental health crisis unfolds in the country after years of drug wars and little psychological help.,2018-04-11T14:00:00Z,al-jazeera-english,Mexico's 'invisible' wounds of gang violence,http://www.aljazeera.com/indepth/features/mexico-invisible-wounds-gang-violence-180409064106883.html,https://www.aljazeera.com/mritems/Images/2018/4/9/3e5619fdb528455ab3f7dc0293d0ef4b_18.jpg,general,2018-04-12 01:45:11.497061
Mariya Petkova,Russian football ultras complain of pressure and harassment by security agencies ahead of Russia 2018.,2018-04-11T04:53:00Z,al-jazeera-english,Russian football hooligans face a crackdown ahead of World Cup,http://www.aljazeera.com/indepth/features/russian-football-hooligans-face-crackdown-world-cup-180410083901797.html,https://www.aljazeera.com/mritems/Images/2018/4/10/da76fa8f4d374e1badd563c8eb3dc979_18.jpg,general,2018-04-12 01:45:11.497061
Zeenat Saberin,Activists fear amendment to electoral law will make Indian politics opaque and vulnerable to foreign influence.,2018-04-11T06:26:00Z,al-jazeera-english,"India parties now can get foreign funding, activists say not OK",http://www.aljazeera.com/indepth/features/india-parties-foreign-funding-activists-180410122808220.html,https://www.aljazeera.com/mritems/Images/2018/4/11/b689dddf3a0c4bd5ae5644b20fa6e9dd_18.jpg,general,2018-04-12 01:45:11.497061
Ramzy Baroud,"The people of Gaza rose up not because of Palestinian political factions, but despite them.",2018-04-11T13:41:00Z,al-jazeera-english,What Palestinians can teach us about popular resistance,http://www.aljazeera.com/indepth/opinion/palestinians-teach-popular-resistance-180410085806588.html,https://www.aljazeera.com/mritems/Images/2018/4/10/58cc97e5f3d74dd0b57ee2af93d8bb20_18.jpg,general,2018-04-12 01:45:11.497061
Hamza Mohamed,Former residents of Nigeria's current capital say they were forcibly removed without proper compensation.,2018-04-11T05:36:00Z,al-jazeera-english,Nigeria: Clearing the locals to make Abuja the capital,http://www.aljazeera.com/indepth/features/nigeria-clearing-locals-abuja-capital-180408072143042.html,https://www.aljazeera.com/mritems/Images/2018/4/9/dce3dc38792a40c89fc59059a64bba24_18.jpg,general,2018-04-12 01:45:11.497061
Mersiha Gadzo,International Criminal Court to decide on the appeal to overturn the 2016 acquittal of Serbian leader Vojislav Seselj.,2018-04-11T07:52:00Z,al-jazeera-english,Denial of genocide prevails in dream for 'Greater Serbia',http://www.aljazeera.com/indepth/features/denial-genocide-prevails-dream-greater-serbia-180411055626581.html,https://www.aljazeera.com/mritems/Images/2018/4/11/cabc76a7ab9d4f62be511dba0815ac6f_18.jpg,general,2018-04-12 01:45:11.497061
Alice McCool,"Ethiopia and Greece's relationship dates back to ancient times, and a small community is keeping both cultures alive.",2018-04-10T07:13:00Z,al-jazeera-english,Ethiopia: The last Greeks of Addis Ababa,http://www.aljazeera.com/indepth/features/ethiopia-greeks-addis-ababa-180402114937892.html,https://www.aljazeera.com/mritems/Images/2018/4/2/09255a6f70a44cdeb2cc8851dcc6eeb4_18.jpg,general,2018-04-12 01:45:11.497061
Samuel Axon,"Warnings have started, but 32-bit support will likely continue for many months.",2018-04-12T00:00:12+00:00,ars-technica,Apple has begun notifying macOS users of coming 32-bit app incompatibility,https://arstechnica.com/gadgets/2018/04/apple-has-begun-notifying-macos-users-of-coming-32-bit-app-incompatibility/,https://cdn.arstechnica.net/wp-content/uploads/2017/09/image_large_2x-760x380.jpg,technology,2018-04-12 01:45:11.497061
Jon Brodkin,FOSTA becomes law—sex work forums were already shutting down to prepare.,2018-04-11T21:15:15+00:00,ars-technica,Trump signs bill to shut down websites that facilitate prostitution,https://arstechnica.com/tech-policy/2018/04/trump-signs-bill-to-shut-down-websites-that-facilitate-prostitution/,https://cdn.arstechnica.net/wp-content/uploads/2018/04/getty-trump-fosta-760x380.jpg,technology,2018-04-12 01:45:11.497061
Cyrus Farivar,Suing over patents hasn’t paid off: VirnetX lost over $75M from 2015 through 2017.,2018-04-11T20:46:23+00:00,ars-technica,Apple ordered to pay $502.6M to VirnetX after jury finds patent infringement,https://arstechnica.com/tech-policy/2018/04/apple-ordered-to-pay-502-6m-to-virnetx-after-jury-finds-patent-infringement/,https://cdn.arstechnica.net/wp-content/uploads/2018/04/GettyImages-493613684-760x380.jpg,technology,2018-04-12 01:45:11.497061
John Timmer,"For a fraction of a second, a pulsar stopped pulsing.",2018-04-11T19:42:09+00:00,ars-technica,Three years of staring lets scientists capture a neutron star “glitch”,https://arstechnica.com/science/2018/04/neutron-star-glitch-hints-at-superfluid-beneath-its-crust/,https://cdn.arstechnica.net/wp-content/uploads/2018/04/figure1-634x380.jpg,technology,2018-04-12 01:45:11.497061
Jon Brodkin,AT&T boasts about millimeter-wave 5G as it prepares for late 2018 launch.,2018-04-11T17:55:45+00:00,ars-technica,AT&T’s 5G trials produce gigabit speeds and 9ms latency,https://arstechnica.com/information-technology/2018/04/atts-5g-trials-produce-gigabit-speeds-and-9ms-latency/,https://cdn.arstechnica.net/wp-content/uploads/2018/04/att-phones-760x380.jpg,technology,2018-04-12 01:45:11.497061
Ron Amadeo,This Google-branded device looks like a Chromecast on steroids.,2018-04-11T17:38:00+00:00,ars-technica,Mysterious Google-branded 4K Android TV dongle shows up at the FCC [Updated],https://arstechnica.com/gadgets/2018/04/mysterious-google-branded-4k-android-tv-dongle-shows-up-at-the-fcc/,https://cdn.arstechnica.net/wp-content/uploads/2018/04/29-760x380.jpg,technology,2018-04-12 01:45:11.497061
Megan Geuss,Market regulators looking outside Australia for ways to price battery storage.,2018-04-11T16:45:33+00:00,ars-technica,Australian Energy Market Operator likes its new Tesla battery quite a bit,https://arstechnica.com/information-technology/2018/04/australian-energy-market-operator-likes-its-new-tesla-battery-quite-a-bit/,https://cdn.arstechnica.net/wp-content/uploads/2018/04/GettyImages-855492106-760x380.jpg,technology,2018-04-12 01:45:11.497061
Peter Bright,"Systems will still need updated firmware to get the latest microcode, however.",2018-04-11T16:32:56+00:00,ars-technica,AMD systems gain Spectre protection with latest Windows fixes,https://arstechnica.com/gadgets/2018/04/latest-windows-updates-bring-spectre-protection-to-amd-systems/,https://cdn.arstechnica.net/wp-content/uploads/2018/02/zen-die-macro-760x380.jpg,technology,2018-04-12 01:45:11.497061
Ron Amadeo,The original Google-branded phones are no longer for sale.,2018-04-11T16:24:51+00:00,ars-technica,Google stops selling the Pixel and Pixel XL,https://arstechnica.com/gadgets/2018/04/google-stops-selling-the-pixel-and-pixel-xl/,https://cdn.arstechnica.net/wp-content/uploads/2016/10/Google-Pixel-20-760x380.jpg,technology,2018-04-12 01:45:11.497061
John Timmer,"Rather than burying our emissions, companies hope to turn them into products.",2018-04-11T15:35:26+00:00,ars-technica,Putting CO₂ to use: 10 finalists named for Carbon XPrize,https://arstechnica.com/science/2018/04/putting-co%e2%82%82-to-use-10-finalists-named-for-carbon-xprize/,https://cdn.arstechnica.net/wp-content/uploads/2018/04/carbon-sequestion-760x302.jpg,technology,2018-04-12 01:45:11.497061
JAKE PEARSON and JEFF HORWITZ,"NEW YORK (AP) — Eight months before the company that owns the National Enquirer paid $150,000 to a former Playboy Playmate who claimed she'd had an affair with Donald Trump, the tabloid's parent made a $30,000 payment to a less famous individual: a former doorman at one of the real estate mogul's New York City buildings. As it did with the ex-Playmate, the Enquirer signed the ex-doorman to a contract that effectively prevented him from going public with a juicy tale that might hurt Trump's campaign for president.",2018-04-12T05:21:37Z,associated-press,"$30,000 rumor? Tabloid paid for, spiked, salacious Trump tip",https://apnews.com/f37ecfc4710b468db6a103a245146172,https://storage.googleapis.com/afs-prod/media/media:7b6a455f017b4174bd8f0eb772c17514/2874.jpeg,general,2018-04-12 01:45:11.497061
ALAN FRAM,"WASHINGTON (AP) — Some say it's a fight between West and South. Or a battle for President Donald Trump's affections. Or a test of who can woo conservatives. But one thing is clear: If the showdown between California Rep. Kevin McCarthy and Louisiana Rep. Steve Scalise for House speaker is a popularity contest, it will be tight. ""Steve is the more low-key guy, Kevin is more the big handshake, but they're equally popular,"" said Rep. Peter King, R-N.Y. ""It's not like right versus left or a good guy versus a bad guy.""",2018-04-12T04:37:29Z,associated-press,"McCarthy, Scalise are likely contenders for House speaker",https://apnews.com/10447d12b8f44e349021eb1585132f46,https://storage.googleapis.com/afs-prod/media/media:2512d0c1ccdb4fd0b8fb6f8568d51756/3000.jpeg,general,2018-04-12 01:45:11.497061
,"BEIJING (AP) — China's government on Thursday denied President Xi Jinping's promise of market-opening measures this week was aimed at settling a tariff dispute with Washington and said negotiations are impossible under ""unilateral coercion"" by the United States. A commerce ministry spokesman, Gao Feng, complained U.S. President Donald Trump's government has ""shown no sincerity,"" according to the official Xinhua News Agency. Gao said the two sides have yet to start negotiations.",2018-04-12T05:05:37Z,associated-press,China denies Xi comments aimed at settling US dispute,https://apnews.com/8e1486119f524029a1dbd8f47442d5a8,,general,2018-04-12 01:45:11.497061
NATALIYA VASILYEVA and VLADIMIR ISACHENKOV,"MOSCOW (AP) — When the U.S. fired Tomahawk missiles at a Syrian airfield a year ago after a chemical weapons attack, the Pentagon gave Moscow advance warning to get its personnel out of harm's way. Since then, U.S.-Russian relations have soured, and the two nuclear powers have raised the ante, getting dangerously close to a potential military clash in Syria. U.S. President Donald Trump has taunted Moscow to ""get ready"" for ""nice and new and 'smart'"" missiles coming to punish Syria for a purported chemical attack on Saturday that killed at least 40 people. The tweet followed Russia's warning that it will strike at incoming U.S. missiles and their launch platforms.",2018-04-11T19:48:31Z,associated-press,"US, Russia trade rhetoric, edge toward showdown over Syria",https://apnews.com/a4278c97d6bf480789a933b103b9acb1,https://storage.googleapis.com/afs-prod/media/media:177e6b257af5453f9c3ddba99df7afa8/3000.jpeg,general,2018-04-12 01:45:11.497061
"JONATHAN LEMIRE, CATHERINE LUCEY and ZEKE MILLER","WASHINGTON (AP) — The Russia collusion probe. The Stormy Daniels allegations. The escalating tension with Moscow. The tempests that have separately buffeted the White House for months merged into a maelstrom this week and threatened to engulf President Donald Trump, who on Wednesday railed against members of the Justice Department by name and took to Twitter to threaten military strikes in Syria and taunt a nuclear-armed power.",2018-04-12T04:21:32Z,associated-press,Trump tweets about conspiracies he sees behind challenges,https://apnews.com/7e186aefb20049bcaf467abe421fa83e,https://storage.googleapis.com/afs-prod/media/media:5f3ce9a2c23b425c91f7122abe989089/3000.jpeg,general,2018-04-12 01:45:11.497061
KATHLEEN RONAYNE,"SACRAMENTO, Calif. (AP) — California Gov. Jerry Brown accepted President Donald Trump's call to send the National Guard to the Mexican border, but rejected the White House's portrait of a burgeoning border crisis and insisted that his troops will have nothing to do with immigration enforcement. The Democratic governor broke a week of silence Wednesday by agreeing to contribute 400 troops, though not all will be on the border. Brown's commitment brought pledges from the four states that border Mexico just shy of the low end of the president's target to marshal 2,000 to 4,000 troops.",2018-04-12T02:03:18Z,associated-press,"California joins Guard border mission, shuns Trump's message",https://apnews.com/fbb7bca5bda849c7ac248242b6438506,https://storage.googleapis.com/afs-prod/media/media:5cc44f72190c42a7b7ba3caecd4543b5/3000.jpeg,general,2018-04-12 01:45:11.497061
DAVID A. LIEB and SUMMER BALLENTINE,"JEFFERSON CITY, Mo. (AP) — Missouri Gov. Eric Greitens calls it an ""entirely consensual relationship."" But the woman with whom he has acknowledged having an affair says Greitens spanked, slapped, grabbed and shoved her during a series of sexual encounters that at times left her crying and afraid. The woman's graphic testimony was revealed in a report released Wednesday by a special Missouri legislative committee that now is expanding its mission to recommend whether lawmakers should begin impeachment proceedings to try to remove the Republican governor from office.",2018-04-12T04:45:15Z,associated-press,"Report: Missouri Gov. Greitens slapped, grabbed woman",https://apnews.com/3b90e6d121e348beadf3ae3fcdcbd021,https://storage.googleapis.com/afs-prod/media/media:02635f4d494242ddacf3b2029881c08e/3000.jpeg,general,2018-04-12 01:45:11.497061
PHILIP MARCELO,"BOSTON (AP) — Five years after two brothers who had been living in America for about a decade bombed the Boston Marathon, federally funded community programs to prevent attacks by homegrown extremists are barely underway and face an uncertain future. These projects, which grew out of a strategy developed during the Obama administration, are aimed at steering young people away from extremism. But they have been hobbled almost from the start by suspicion and mistrust among Muslims, who complain they are being singled out. And it's unclear whether the strategy will continue to be funded under the Trump administration.",2018-04-12T04:31:46Z,associated-press,"5 years after Boston bombing, anti-extremism efforts falter",https://apnews.com/4d844515c878488195d2e064a8586ca4,,general,2018-04-12 01:45:11.497061
MARY CLARE JALONICK and BARBARA ORTUTAY,"WASHINGTON (AP) — Facebook CEO Mark Zuckerberg acknowledged that regulation of social media companies is ""inevitable"" and disclosed that his own personal information has been compromised by malicious outsiders. But after two days of congressional testimony, what seemed clear was how little Congress seems to know about Facebook, much less what to do about it. House lawmakers aggressively questioned Zuckerberg Wednesday on user data, privacy settings and whether the company is biased against conservatives. As they did in the Senate a day earlier, both Republicans and Democrats suggested that regulation might be needed, but there was no consensus and few specifics about what that might look like — or even what the biggest problems are.",2018-04-12T04:17:08Z,associated-press,Zuckerberg: Regulation 'inevitable' for social media firms,https://apnews.com/04076e945181477cb9e08a5383528b15,https://storage.googleapis.com/afs-prod/media/media:71c299a92cd443f9855447110ac92351/3000.jpeg,general,2018-04-12 01:45:11.497061
JULIET LINDERMAN and JONATHAN LEMIRE,"WASHINGTON (AP) — The Trump administration is considering a plan that would allow states to require certain food stamp recipients to undergo drug testing, handing a win to conservatives who've long sought ways to curb the safety net program. The proposal under review would be narrowly targeted, applying mostly to people who are able-bodied, without dependents and applying for some specialized jobs, according to an administration official briefed on the plan. The official, who spoke on condition of anonymity to discuss internal deliberations, said roughly 5 percent of participants in the Supplemental Nutrition Assistance Program could be affected.",2018-04-12T04:17:25Z,associated-press,Plan would allow drug testing for some food stamp recipients,https://apnews.com/c901e506fb6949bb81ea5bbcb1f513b5,https://storage.googleapis.com/afs-prod/media/media:5d785eb6601946279cc8bd27a1fc4df1/3000.jpeg,general,2018-04-12 01:45:11.497061
BBC News,"The White House says ""all options are on the table"" in response to a suspected chemical attack.",2018-04-12T01:38:24Z,bbc-news,US weighs military response over Syria,http://www.bbc.co.uk/news/world-middle-east-43734655,https://ichef-1.bbci.co.uk/news/1024/branded_news/93DB/production/_100815873_hi046107629.jpg,general,2018-04-12 01:45:11.497061
BBC News,We ask foreign policy experts around the world whether we are heading for a third world war.,2018-04-11T16:56:17Z,bbc-news,Are we heading for a third world war?,http://www.bbc.co.uk/news/world-43732320,https://ichef-1.bbci.co.uk/news/1024/branded_news/434F/production/_100813271_p064032d.png,general,2018-04-12 01:45:11.497061
BBC News,"Yulia Skripal, poisoned daughter of Russian ex-spy Sergei, rejects Russian help ""at the moment"".",2018-04-11T19:12:51Z,bbc-news,No-one speaks for me - Yulia Skripal,http://www.bbc.co.uk/news/uk-43733765,https://ichef.bbci.co.uk/news/1024/branded_news/7A23/production/_97176213_breaking_news_bigger.png,general,2018-04-12 01:45:11.497061
BBC News,The ex-officer who was fired after the United Airlines incident alleges he was not properly trained.,2018-04-11T23:55:16Z,bbc-news,Officer who dragged man from plane sues,http://www.bbc.co.uk/news/world-us-canada-43734466,https://ichef.bbci.co.uk/images/ic/1024x576/p04znxfg.jpg,general,2018-04-12 01:45:11.497061
BBC News,Mariela and her husband work as paramedics in one of the most violent cities in Mexico.,2018-04-11T21:14:42Z,bbc-news,The paramedic couple who mostly collect bodies,http://www.bbc.co.uk/news/stories-43717103,https://ichef-1.bbci.co.uk/news/1024/branded_news/15FD4/production/_100786009_p063wzvg.jpg,general,2018-04-12 01:45:11.497061
BBC News,The conservative star's exit is a big blow to Republicans as the mid-term elections loom.,2018-04-11T21:02:03Z,bbc-news,US House Speaker Paul Ryan to stand down,http://www.bbc.co.uk/news/world-us-canada-43729218,https://ichef.bbci.co.uk/images/ic/1024x576/p0640sty.jpg,general,2018-04-12 01:45:11.497061
BBC News,"After winning Australia's largest payout of its kind, the actress sought to recover her sizeable legal costs.",2018-04-12T03:39:21Z,bbc-news,Rebel Wilson to recoup defamation case fees,http://www.bbc.co.uk/news/world-australia-43734695,https://ichef-1.bbci.co.uk/news/1024/branded_news/7883/production/_100815803_gettyimages-881532654.jpg,general,2018-04-12 01:45:11.497061
BBC News,"The UN disputes claims that civilians were killed during an operation in the CAR capital, Bangui.",2018-04-12T03:57:31Z,bbc-news,UN: Dead bodies protest was propaganda,http://www.bbc.co.uk/news/world-africa-43735333,https://ichef-1.bbci.co.uk/news/1024/branded_news/1572B/production/_100815878_hi046100558.jpg,general,2018-04-12 01:45:11.497061
BBC News,More than 60 Worker's Party members took the step after Luiz Inacio Lula da Silva was jailed.,2018-04-11T23:41:19Z,bbc-news,Brazil legislators' adopt Lula's name,http://www.bbc.co.uk/news/world-latin-america-43734354,https://ichef-1.bbci.co.uk/news/1024/branded_news/0993/production/_100815420_mediaitem100815419.jpg,general,2018-04-12 01:45:11.497061
BBC News,A surrogate mother gave birth as the biological parents had frozen embryos before they died in a car crash.,2018-04-12T02:00:04Z,bbc-news,Baby born four years after parents' death,http://www.bbc.co.uk/news/world-asia-china-43724395,https://ichef.bbci.co.uk/news/1024/branded_news/72FD/production/_92473492_m8020231-in_vitro_fertilization_light_microscope-spl.jpg,general,2018-04-12 01:45:11.497061
BBC Sport,"Watch BBC TV coverage, in-play clips and follow text updates on day eight from the Commonwealth Games on the Gold Coast.",2018-04-11T23:06:03Z,bbc-sport,Watch Commonwealth Games: Day Eight,http://www.bbc.co.uk/sport/live/commonwealth-games/43377299,https://m.files.bbci.co.uk/modules/bbc-morph-sport-opengraph/1.1.1/images/bbc-sport-logo.png,sports,2018-04-12 01:45:11.497061
BBC Sport,Cristiano Ronaldo's injury-time penalty put holders Real Madrid through to the Champions League semi-finals after a stunning Juventus comeback.,2018-04-11T20:47:15Z,bbc-sport,Real Madrid 1-3 Juventus (agg: 4-3),http://www.bbc.co.uk/sport/football/43632225,https://ichef.bbci.co.uk/onesport/cps/624/cpsprodpb/13590/production/_97584297_breaking_news.png,sports,2018-04-12 01:45:11.497061
BBC Sport,England win their first Commonwealth Games medals in women's mountain biking as Annie Last takes gold ahead of team-mate Evie Richards.,2018-04-12T02:07:45Z,bbc-sport,Commonwealth Games: England's Annie Last wins mountain bike cross-country,http://www.bbc.co.uk/sport/commonwealth-games/43734935,https://ichef.bbci.co.uk/onesport/cps/624/cpsprodpb/EE85/production/_100816016_last.jpg,sports,2018-04-12 01:45:11.497061
BBC Sport,England's Jack Laugher and Malaysia's Ahmad Amsyar Azman both suffer diving fails during the men's 3m springboard qualification stage.,2018-04-11T21:49:40Z,bbc-sport,Commonwealth Games: Jack Laugher and Ahmad Azman suffer diving fails,http://www.bbc.co.uk/sport/commonwealth-games/43734740,https://ichef.bbci.co.uk/onesport/cps/624/cpsprodpb/1721F/production/_100815749_p0641kzb.jpg,sports,2018-04-12 01:45:11.497061
BBC Sport,Tottenham striker Harry Kane is awarded Spurs' second goal in Saturday's 2-1 win at Stoke after a successful appeal.,2018-04-11T16:14:48Z,bbc-sport,Premier League: Tottenham goal at Stoke awarded to Harry Kane,http://www.bbc.co.uk/sport/football/43731208,https://ichef.bbci.co.uk/onesport/cps/624/cpsprodpb/13590/production/_97584297_breaking_news.png,sports,2018-04-12 01:45:11.497061
