author,description,publishedAt,source,title,url,urlToImage,category,scraping_date
Patrick Greenfield,"Salisbury poison victim says she is not ready to talk publicly, and urges her cousin to stay away",2018-04-11T19:40:34Z,the-guardian-uk,I don't need any help from the Russian embassy – Yulia Skripal,https://www.theguardian.com/uk-news/2018/apr/11/i-dont-need-any-help-from-the-russian-embassy-yulia-skripal,https://i.guim.co.uk/img/media/554a11a01b6739e14d06f6ec5774781727990a4f/0_477_1536_922/master/1536.jpg?w=1200&h=630&q=55&auto=format&usm=12&fit=crop&crop=faces%2Centropy&bm=normal&ba=bottom%2Cleft&blend64=aHR0cHM6Ly91cGxvYWRzLmd1aW0uY28udWsvMjAxOC8wMS8zMS9mYWNlYm9va19kZWZhdWx0LnBuZw&s=5ee0ce6072a82379b6c02fa7d99dbf77,general,2018-04-12 01:45:11.497061
Vikram Dodd,"Ahead of the 25th anniversary of racist killing, Scotland Yard says it is considering closing investigation down",2018-04-11T15:16:10Z,the-guardian-uk,Stephen Lawrence murder: police say they have run out of leads,https://www.theguardian.com/uk-news/2018/apr/11/stephen-lawrence-murder-police-say-they-have-run-out-of-leads,https://i.guim.co.uk/img/media/7ff3e62222166f993af5ac209cf408f2e5ac55ff/0_567_1507_903/master/1507.jpg?w=1200&h=630&q=55&auto=format&usm=12&fit=crop&crop=faces%2Centropy&bm=normal&ba=bottom%2Cleft&blend64=aHR0cHM6Ly91cGxvYWRzLmd1aW0uY28udWsvMjAxOC8wMS8zMS9mYWNlYm9va19kZWZhdWx0LnBuZw&s=9e543a8c9b89168bcf55f96068b8f9d6,general,2018-04-12 01:45:11.497061
David Smith,"In his second day on Capitol Hill, Zuckerberg faces tougher questioning and says his own data was handed to Cambridge Analytica",2018-04-11T19:51:08Z,the-guardian-uk,Zuckerberg put on back foot as House grills Facebook CEO over user tracking,https://www.theguardian.com/technology/2018/apr/11/zuckerberg-hearing-facebook-tracking-questions-house-back-foot,https://i.guim.co.uk/img/media/37b4561e6f577985d0137598748a2870ecfea0e4/0_78_4844_2906/master/4844.jpg?w=1200&h=630&q=55&auto=format&usm=12&fit=crop&crop=faces%2Centropy&bm=normal&ba=bottom%2Cleft&blend64=aHR0cHM6Ly91cGxvYWRzLmd1aW0uY28udWsvMjAxOC8wMS8zMS9mYWNlYm9va19kZWZhdWx0LnBuZw&s=685d7a8984b5b061c4404621c47c4fe2,general,2018-04-12 01:45:11.497061
Patrick Butler,Analysis shows that self-employed workers could receive less over a year than employees in “traditional” jobs who earn the same amount,2018-04-11T23:01:15Z,the-guardian-uk,Universal credit 'flaws' mean thousands will be worse off,https://www.theguardian.com/society/2018/apr/12/universal-credit-flaws-mean-thousands-will-be-worse-off,https://i.guim.co.uk/img/media/8bd709b95247c85a205234caf6fdfef86da318b6/0_120_3600_2160/master/3600.jpg?w=1200&h=630&q=55&auto=format&usm=12&fit=crop&crop=faces%2Centropy&bm=normal&ba=bottom%2Cleft&blend64=aHR0cHM6Ly91cGxvYWRzLmd1aW0uY28udWsvMjAxOC8wMS8zMS9mYWNlYm9va19kZWZhdWx0LnBuZw&s=62ca842e60ac76e7219e1ede460566f6,general,2018-04-12 01:45:11.497061
Patrick Collinson,"Demand from buyers fell for the 12th month in a row in March, says Royal Institution of Chartered Surveyors",2018-04-11T23:01:15Z,the-guardian-uk,Surveyors issue most downbeat assessment of housing market for five years,https://www.theguardian.com/business/2018/apr/12/surveyors-issue-most-downbeat-assessment-of-housing-market-for-five-years,https://i.guim.co.uk/img/media/606f8f87b8863bc1b8b38d30611b5e201d21096f/32_0_3437_2062/master/3437.jpg?w=1200&h=630&q=55&auto=format&usm=12&fit=crop&crop=faces%2Centropy&bm=normal&ba=bottom%2Cleft&blend64=aHR0cHM6Ly91cGxvYWRzLmd1aW0uY28udWsvMjAxOC8wMS8zMS9mYWNlYm9va19kZWZhdWx0LnBuZw&s=07fa03f78675990852af17398156aa69,general,2018-04-12 01:45:11.497061
Jessica Elgot,Councils opting for publicly owned bus services to get funds partly arising from road tax,2018-04-11T21:31:41Z,the-guardian-uk,Labour announces plan for under 25s to have free bus travel,https://www.theguardian.com/politics/2018/apr/11/labour-announces-plan-for-under-25s-to-have-free-bus-travel,https://i.guim.co.uk/img/media/94a822e593b6b96aa9be8f79cf8a0ebf60628f3f/0_0_3000_1800/master/3000.jpg?w=1200&h=630&q=55&auto=format&usm=12&fit=crop&crop=faces%2Centropy&bm=normal&ba=bottom%2Cleft&blend64=aHR0cHM6Ly91cGxvYWRzLmd1aW0uY28udWsvMjAxOC8wMS8zMS9mYWNlYm9va19kZWZhdWx0LnBuZw&s=87ddf7354b9407c00943bf80f65d1a0f,general,2018-04-12 01:45:11.497061
Special Correspondent,"Although 1I is the ninth to be launched in the NavIC navigation fleet, it counts as the eighth.",2018-04-12T02:02:33Z,the-hindu,"IRNSS-1I up in orbit, completes navigation fleet",http://www.thehindu.com/sci-tech/science/irnss-1i-up-in-orbit-completes-navigation-fleet/article23508603.ece,http://www.thehindu.com/sci-tech/science/article23508602.ece/ALTERNATES/LANDSCAPE_615/INDIA-SPACE-SATELLITE,general,2018-04-12 01:45:11.497061
The Hindu,,2018-04-12T03:52:00Z,the-hindu,"Govt orders CBI probe in Unnao gang rape case, MLA booked",http://www.thehindu.com/news/national/other-states/govt-orders-cbi-probe-in-unnao-gang-rape-case/article23508894.ece,http://www.thehindu.com/news/national/article23493939.ece/ALTERNATES/LANDSCAPE_615/UNNAO,general,2018-04-12 01:45:11.497061
PTI,"8-year-old kept captive, raped, beaten to death",2018-04-11T19:49:28Z,the-hindu,Charge sheet reveals Kathua horror,http://www.thehindu.com/news/national/charge-sheet-reveals-kathua-horror/article23506811.ece,http://www.thehindu.com/news/national/article23506810.ece/ALTERNATES/LANDSCAPE_615/12THKASHMIR-PG1,general,2018-04-12 01:45:11.497061
Nagesh Prabhu & Bageshree S.,"In 2019, all secular-minded people should come together to defeat the communal forces at the national level, the Karnataka Chief Minister says.",2018-04-11T16:11:57Z,the-hindu,Congress has to come back to power in Karnataka: Siddaramaiah,http://www.thehindu.com/elections/karnataka-2018/congress-has-to-come-back-to-power-in-karnataka-siddaramaiah/article23505190.ece,http://www.thehindu.com/elections/karnataka-2018/article23505189.ece/ALTERNATES/LANDSCAPE_615/THJC-SIDDARAMAIAH,general,2018-04-12 01:45:11.497061
PTI,"According to IPL sources, Visakhapatnam is front-runner from among the four cities, the other three being Trivandrum, Pune and Rajkot.",2018-04-11T11:58:04Z,the-hindu,BCCI mulls shifting CSK matches out of Chennai; picks 4 stand-by cities,http://www.thehindu.com/sport/cricket/indian-premier-league-2018-bcci-mulls-shifting-csk-matches-out-of-chennai-picks-4-stand-by-cities/article23503349.ece,http://www.thehindu.com/sport/cricket/article23503348.ece/ALTERNATES/LANDSCAPE_615/IPLCHENNAI,general,2018-04-12 01:45:11.497061
Reuters,The internet magnate pushes back on U.S. House of Representatives Energy and Commerce Committee members’ suggestions that users do not have enough control of their data on Facebook.,2018-04-11T16:00:41Z,the-hindu,Facebook CEO Zuckerberg says his own data was shared by Cambridge Analytica,http://www.thehindu.com/sci-tech/technology/internet/facebook-ceo-zuckerberg-says-his-own-data-was-shared-by-cambridge-analytica/article23505123.ece,http://www.thehindu.com/sci-tech/technology/internet/article23505118.ece/ALTERNATES/LANDSCAPE_615/FACEBOOK-PRIVACYZUCKERBERG,general,2018-04-12 01:45:11.497061
The Hindu,The withdrawal of ill-conceived restrictions on livestock trade is welcome,2018-04-11T18:36:44Z,the-hindu,End to cattle curbs: on withdrawal of sale ban,http://www.thehindu.com/opinion/editorial/end-to-cattle-curbs/article23505866.ece,http://www.thehindu.com/static/theme/default/base/img/og-image.jpg,general,2018-04-12 01:45:11.497061
The Hindu,Viktor Orbán’s emphatic re-election in Hungary has implications for all of Europe,2018-04-11T17:40:51Z,the-hindu,Hungary: Tightening grip,http://www.thehindu.com/opinion/editorial/hungary-tightening-grip/article23505867.ece,http://www.thehindu.com/static/theme/default/base/img/og-image.jpg,general,2018-04-12 01:45:11.497061
Dana Liebelson,"""Trump has turned the clock back on the progress we’ve made in this country.""",2018-02-13T02:16:26Z,the-huffington-post,"In Rob Porter Case, Trump Sends A Message: We Will Protect Powerful Alleged Abusers",http://www.huffingtonpost.com/entry/rob-porter-trump-powerful-alleged-abusers_us_5a821a35e4b01467fcf07650?ncid=inblnkushpmg00000009,http://img.huffingtonpost.com/asset/5a821ceb1e0000dc007ab7bd.jpeg?ops=1200_630,general,2018-04-12 01:45:11.497061
Eoin Blackwell,Family dinners at Kevin Nicholson's house might get awkward.,2018-02-13T03:23:00Z,the-huffington-post,Parents Of Republican Senate Hopeful Max Out Donations To Democratic Opponent,http://www.huffingtonpost.com/entry/kevin-nicholson-parents-donation_us_5a8246b6e4b0892a03522378?ncid=inblnkushpmg00000009,https://img.huffingtonpost.com/asset/5a824c011e0000dc007ab7e1.jpeg?ops=1910_1000,general,2018-04-12 01:45:11.497061
Ed Mazza,Bonkers new spot features an angry dude smashing his TV.,2018-02-13T06:01:09Z,the-huffington-post,"The NRA Really Wants You To Stop Making Fun Of Trump Now, OK?",http://www.huffingtonpost.com/entry/nra-tv-smashing-ad_us_5a826959e4b0892a035243ec?ncid=inblnkushpmg00000009,http://img.huffingtonpost.com/asset/5a8277dd2000003900eaeabb.jpeg?ops=1200_630,general,2018-04-12 01:45:11.497061
David Moye,"Paul Nehlen superimposed a picture of Cheddar Man, an ancient Briton with dark skin, over Markle's face.",2018-02-12T19:53:20Z,the-huffington-post,Twitter Bans GOP Candidate For Racist Meghan Markle Tweet,http://www.huffingtonpost.com/entry/paul-nehlen-meghan-markle-twitter-ban_us_5a81c9c3e4b08dfc930694cc?ncid=inblnkushpmg00000009,http://img.huffingtonpost.com/asset/5a81cb162100003900600f89.jpeg?ops=1200_630,general,2018-04-12 01:45:11.497061
Zach Carter,He just doesn't care.,2018-02-12T23:22:15Z,the-huffington-post,What You Should Know About Trump's Nihilist Budget,http://www.huffingtonpost.com/entry/trump-budget-fine-print_us_5a820d8ae4b01467fcf06af8?ncid=inblnkushpmg00000009,http://img.huffingtonpost.com/asset/5a820de71e000037007ab7a4.jpeg?ops=1200_630,general,2018-04-12 01:45:11.497061
On assignment for HuffPost,But local communities are starting to take back control.,2018-02-13T10:47:05Z,the-huffington-post,Eastern Kentucky's Struggle With Water Symbolizes America's Crumbling Infrastructure,http://www.huffingtonpost.com/entry/appalachia-eastern-kentucky-water-shutoffs_us_5a7c91b2e4b0c6726e10b620?ncid=inblnkushpmg00000009,https://img.huffingtonpost.com/asset/5a817ddc1e000038007ab68d.jpeg?ops=1910_1000,general,2018-04-12 01:45:11.497061
Josh Butler,The 17-year-old wins with a near-perfect 98.25 score.,2018-02-13T02:46:49Z,the-huffington-post,Chloe Kim Takes Gold For U.S. In Women's Snowboard Halfpipe,http://www.huffingtonpost.com/entry/chloe-kim-snowboarding-gold_us_5a8242e0e4b00ecc923d597f?ncid=inblnkushpmg00000009,http://img.huffingtonpost.com/asset/5a8249901e000037007ab7de.jpeg?ops=1200_630,general,2018-04-12 01:45:11.497061
Ed Mazza,"As Team USA racks up wins, the president has been unusually silent.",2018-02-13T08:06:16Z,the-huffington-post,"Trump Used Twitter To Defend Alleged Abusers, But Not To Congratulate U.S. Medal Winners",http://www.huffingtonpost.com/entry/trump-olympics-tweets_us_5a82813be4b01467fcf0c628?ncid=inblnkushpmg00000009,http://img.huffingtonpost.com/asset/5a8284892000002d00eaeac4.jpeg?ops=1200_630,general,2018-04-12 01:45:11.497061
Nick Visser,"""The networks undercovered or ignored the ways that climate change had real-life impacts on people.""",2018-02-13T06:22:31Z,the-huffington-post,TV Networks Did A Really Crap Job Reporting On Climate Change Last Year,http://www.huffingtonpost.com/entry/us-television-climate-change_us_5a822ff0e4b01467fcf0892b?ncid=inblnkushpmg00000009,http://img.huffingtonpost.com/asset/5a8273f3210000380060104c.jpeg?ops=1200_630,general,2018-04-12 01:45:11.497061
Nina Golgowski,The athlete was reportedly taken to a hospital for evaluation.,2018-02-13T13:39:48Z,the-huffington-post,U.S. Luger Emily Sweeney Wipes Out In Dramatic Olympics Crash,http://www.huffingtonpost.com/entry/luge-emily-sweeney-crash_us_5a82df99e4b01467fcf17f22?ncid=inblnkushpmg00000009,https://img.huffingtonpost.com/asset/5a82e4152100003800601109.jpeg?cache=lktstgeiay&ops=1910_1000,general,2018-04-12 01:45:11.497061
Tom Wood,Some people go to great lengths to show their devotion to God.,2018-04-11T19:55:41,the-lad-bible,Indian Holy Man Drags A Car 100ft Tied To His Penis,http://www.theladbible.com/news/weird-news-indian-holy-man-drags-a-car-100ft-tied-to-his-penis-20180411,http://beta.ems.ladbiblegroup.com/s3/content/808x455/2c00d2a35ace08a93e589418ec34bf39.png,entertainment,2018-04-12 01:45:11.497061
Tom Wood,"It's #NationalPetDay guys, get excited!",2018-04-11T19:48:53,the-lad-bible,"Chris Evans Shared A Heartwarming Video Of His Pet Dog, Dodger",http://www.theladbible.com/news/celebrity-film-and-tv-news-feels-chris-evans-shared-a-heartwarming-video-of-his-pet-dog-dodger-20180411,http://beta.ems.ladbiblegroup.com/s3/content/808x455/30e5a6075ace4fc3260c84a986f29eb2.png,entertainment,2018-04-12 01:45:11.497061
Claire Reid,The officers have now been ordered to appear before a judge,2018-04-11T19:46:45,the-lad-bible,Argentinian Cops Blame Mice For Half A Ton Of Missing Cannabis,http://www.theladbible.com/news/weird-news-argentinian-cops-blame-mice-for-half-a-ton-of-missing-cannabis-20180411,http://beta.ems.ladbiblegroup.com/s3/content/808x455/512599475ace4fc3260c32ebdedb44d2.png,entertainment,2018-04-12 01:45:11.497061
Rebecca Shepherd,Joan Thompson lived with Wynford Hodge for 42 years until he died last year leaving her without a penny of his £1.5million fortune.,2018-04-11T19:46:28,the-lad-bible,Millionaire Leaves Wife Of 42 Years Nothing In £1.5m Fortune,http://www.theladbible.com/community/uk-interesting-millionaire-leaves-wife-of-42-years-nothing-in-15m-fortune-20180411,http://beta.ems.ladbiblegroup.com/s3/content/808x455/e7b3a7345ace92a5a51afe42989353c5.png,entertainment,2018-04-12 01:45:11.497061
Tom Wood,"Just don't do it. Seriously, don't.",2018-04-11T19:18:38,the-lad-bible,There's A Dangerous New Method To Remove Scars With Rubber Bands,http://www.theladbible.com/news/weird-news-fail-theres-a-dangerous-new-method-to-remove-scars-with-rubber-bands-20180411,http://beta.ems.ladbiblegroup.com/s3/content/808x455/f9456f895ace6fa8add78e283f76ed40.png,entertainment,2018-04-12 01:45:11.497061
Claire Reid,The Facebook founder and CEO is facing questioning from US senators but can't stop becoming a meme,2018-04-11T18:51:06,the-lad-bible,People Love Mark Zuckerberg Explaining How The Internet Works To 'Elderly Senators',http://www.theladbible.com/technology/viral-technology-people-love-zuckerberg-explaining-how-internet-works-to-senators-20180411,http://beta.ems.ladbiblegroup.com/s3/content/808x455/c0a5ec775ace9b83b395c9309f4b3b1e.png,entertainment,2018-04-12 01:45:11.497061
Claire Reid,The new treat is made using the 'fourth kind' of chocolate and is said to taste of berries,2018-04-10T10:44:48,the-lad-bible,New Naturally-Pink Chocolate KitKat Launches In The UK,http://www.theladbible.com/community/uk-food-new-naturally-pink-chocolate-kitkat-launches-in-the-uk-20180410,http://beta.ems.ladbiblegroup.com/s3/content/808x455/34038a325acc14492881fe9b0a0761b2.png,entertainment,2018-04-12 01:45:11.497061
Claire Reid,Parts of Britain will have highs of 25C,2018-04-10T11:24:55,the-lad-bible,Britain Predicted To Be Hotter Than Greece Next Week,http://www.theladbible.com/news/uk-news-britain-predicted-to-be-hotter-than-greece-next-week-20180410,http://beta.ems.ladbiblegroup.com/s3/content/808x455/a4d317465acc5a4ffdbc43e647ba45b0.png,entertainment,2018-04-12 01:45:11.497061
Jess Hardiman,Some reports suggest that the man suffers from mental health issues,2018-04-11T11:03:40,the-lad-bible,Naked Man Walks Into Petrol Station With Sex Toy Stuck In Anus,http://www.theladbible.com/news/news-naked-man-walks-into-petrol-station-with-sex-toy-stuck-in-anus-20180411,http://beta.ems.ladbiblegroup.com/s3/content/808x455/6d91e9f45acd88d02c8d27a671107dfa.png,entertainment,2018-04-12 01:45:11.497061
Tom Wood,The SAS and US forces have been on 'kill not capture' missions after an IS bomb killed two soldiers.,2018-04-09T09:37:22,the-lad-bible,At Least 12 Jihadis Killed By SAS After Death Of British Soldier,http://www.theladbible.com/news/news-at-least-12-jihadis-killed-by-sas-after-death-of-british-soldier-20180409,http://beta.ems.ladbiblegroup.com/s3/content/808x455/663ea3e15acb0ef73ec665d5d4ce0125.png,entertainment,2018-04-12 01:45:11.497061
Jonathan Martin and Alexander Burns,"Speaker Paul D. Ryan will tell colleagues in the House that he will retire at the end of the year, signaling the peril that the Republican majority faces.",2018-04-11T14:06:43Z,the-new-york-times,Speaker Paul Ryan Will Not Seek Re-election in November,https://www.nytimes.com/2018/04/11/us/politics/paul-ryan-speaker.html,https://static01.nyt.com/images/2018/04/12/us/politics/12dc-ryan/12dc-ryan-facebookJumbo.jpg,general,2018-04-12 01:45:11.497061
Jonathan Martin and Alexander Burns,"Mr. Ryan’s retirement could make it easier for Democrats to win control of the House, Republicans say. The speaker had raised more than $54 million for the 2018 elections.",2018-04-11T18:58:52Z,the-new-york-times,Paul Ryan Upends Republican Hopes and Plans for Midterm Elections,https://www.nytimes.com/2018/04/11/us/politics/paul-ryan-midterms-republicans.html,https://static01.nyt.com/images/2018/04/12/us/politics/12repubs1/12repubs1-facebookJumbo.jpg,general,2018-04-12 01:45:11.497061
Julie Bosman,"Mr. Ryan’s decision not to run again stunned his constituents. But they also said it made sense, given the chaos of Washington: “They just yell at each other.”",2018-04-11T23:41:37Z,the-new-york-times,Paul Ryan’s Hometown Takes Stock as Speaker (and Neighbor) Changes Course,https://www.nytimes.com/2018/04/11/us/paul-ryan-speaker-retire-janesville.html,https://static01.nyt.com/images/2018/04/12/us/12wisconsin/12wisconsin-facebookJumbo.jpg,general,2018-04-12 01:45:11.497061
Liam Stack,"Even before Mr. Ryan’s surprise announcement that he would not seek re-election in November, several candidates had emerged to challenge him.",2018-04-12T02:58:09Z,the-new-york-times,Who’s Running for Paul Ryan’s House Seat in Wisconsin?,https://www.nytimes.com/2018/04/11/us/politics/randy-bryce-paul-nehlen.html,https://static01.nyt.com/images/2018/04/12/us/politics/12xp-challengers-1/merlin_136698828_3b127097-8d33-41f4-b1ee-e3ac408486a5-facebookJumbo.jpg,general,2018-04-12 01:45:11.497061
"Jim Rutenberg, Emily Steel and Mike McIntire","A federal inquiry is examining the relationship between a tabloid company, President Trump and his lawyer Michael D. Cohen, whose office was raided by the F.B.I.",2018-04-12T01:30:16Z,the-new-york-times,Investigators Focus on Another Trump Ally: The National Enquirer,https://www.nytimes.com/2018/04/11/us/politics/trump-national-enquirer-american-media.html,https://static01.nyt.com/images/2018/04/12/us/12AMIcombo/12AMIcombo-facebookJumbo.jpg,general,2018-04-12 01:45:11.497061
"Maggie Haberman, Matt Apuzzo and Michael S. Schmidt","The warrant also sought evidence of whether the lawyer, Michael D. Cohen, tried to suppress damaging information on the president before the election.",2018-04-11T18:33:28Z,the-new-york-times,Raid on Trump’s Lawyer Sought Records on ‘Access Hollywood’ Tape,https://www.nytimes.com/2018/04/11/us/politics/michael-cohen-trump-access-hollywood.html,https://static01.nyt.com/images/2018/04/12/us/politics/12dc-cohen/12dc-warrant-facebookJumbo.jpg,general,2018-04-12 01:45:11.497061
"Mike McIntire, Jim Rutenberg and Maggie Haberman","A series of disclosures have revealed the unusual range of Michael D. Cohen’s portfolio, and a federal investigation poses a legal threat to him and possibly his client, the president.",2018-04-11T00:42:36Z,the-new-york-times,"Michael Cohen, ‘Ultimate Trump Loyalist,’ Now in the Sights of the F.B.I.",https://www.nytimes.com/2018/04/10/us/politics/michael-cohen-trump.html,https://static01.nyt.com/images/2018/04/11/autossell/11Cohen1/11Cohen1-facebookJumbo.jpg,general,2018-04-12 01:45:11.497061
Charlie Savage,The president has suggested that the Justice Department infringed on confidential communication with his lawyer. But exactly what communication between a lawyer and a client is privileged?,2018-04-10T21:59:42Z,the-new-york-times,Warrants and Privilege: Legal Questions About the Raids on Trump’s Lawyer,https://www.nytimes.com/2018/04/10/us/politics/trump-cohen-raids-legal-issues.html,https://static01.nyt.com/images/2018/04/11/us/politics/11dc-privilege/11dc-privilege-facebookJumbo.jpg,general,2018-04-12 01:45:11.497061
"Peter Baker, Thomas Gibbons-Neff and Helene Cooper","A strike in response to a suspected chemical attack comes with perils that worry military planners and diplomats, and a fresh intervention in a combustible region could bring unintended consequences.",2018-04-12T01:32:10Z,the-new-york-times,"Missiles ‘Will Be Coming’ at Syria, Trump Says. Beyond That Lies Uncertainty.",https://www.nytimes.com/2018/04/11/us/politics/trump-syria.html,https://static01.nyt.com/images/2018/04/12/us/politics/12dc-military-1/merlin_136673352_ffa373a0-6426-4813-b8f3-2f7ee98b1c34-facebookJumbo.jpg,general,2018-04-12 01:45:11.497061
Ben Hubbard,An attack on a Damascus suburb has drawn the threat of a retaliatory missile strike from President Trump. What really happened there?,2018-04-12T00:52:27Z,the-new-york-times,"In a Syrian Town, People Started Shouting: ‘Chemicals! Chemicals!’",https://www.nytimes.com/2018/04/11/world/middleeast/syria-chemical-attack-douma.html,https://static01.nyt.com/images/2018/04/12/world/middleeast/12Syria-TickTock/11syriaattack-facebookJumbo.jpg,general,2018-04-12 01:45:11.497061
Napier Lopez,"The Chromecast is one of the best products Google has ever made. It's low price, small size, and reliability help make streaming video to your TV commonplace, rather than a party trick ...",2018-04-11T22:08:18Z,the-next-web,Opinion: It's time for Google to retire Chromecast for Android TV,https://thenextweb.com/opinion/2018/04/12/opinion-time-google-retire-chromecast-android-tv/,https://cdn0.tnwcdn.com/wp-content/blogs.dir/1/files/2018/04/Chromecast-social.jpg,technology,2018-04-12 01:45:11.497061
Tristan Greene,"Machines are quickly bridging the creative gap between human and artificial intelligence. Last year we were amazed by Nvidia's AI's ability to generate realistic images of fake people, ...",2018-04-11T20:44:08Z,the-next-web,Yabba dabba do! AI can make cartoons too,https://thenextweb.com/artificial-intelligence/2018/04/11/researchers-trained-an-ai-to-create-flintstones-cartoons/,https://cdn0.tnwcdn.com/wp-content/blogs.dir/1/files/2018/04/flintstonesAI.jpg,technology,2018-04-12 01:45:11.497061
Napier Lopez,"Earlier today, Google emailed G Suite customers letting them know a new version of Gmail is on the way. The email was supposed to be 'customer confidential,' so naturally it's already ...",2018-04-11T18:50:06Z,the-next-web,Google: Gmail will get a 'major' redesign soon,https://thenextweb.com/google/2018/04/11/google-gmail-will-get-major-redesign-soon/,https://cdn0.tnwcdn.com/wp-content/blogs.dir/1/files/2018/04/Gmail-Redesign-social.jpg,technology,2018-04-12 01:45:11.497061
Neer Varshney,"Luís Figo — former Portuguese ace footballer — has joined the list of celebrities promoting ICOs. Figo has agreed to become the official brand ambassador for the Stryking entertainment‘s token sale. As per the company announcement, Luís Figo will support Stryking in their efforts to promote Football-Stars and find more partners to cooperate within the […]",2018-04-11T19:28:06Z,the-next-web,Luis Figo becomes latest celebrity to jump on the ICO bandwagon,https://thenextweb.com/hardfork/2018/04/11/luis-figo-becomes-another-celebrity-join-ico-bandwagon/,https://img-cdn.tnwcdn.com/image/hardfork?filter_last=1&fit=1280%2C640&url=https%3A%2F%2Fcdn0.tnwcdn.com%2Fwp-content%2Fblogs.dir%2F1%2Ffiles%2F2018%2F04%2FFigo-SEC.png&expires=17291467757&signature=452c6cefa8dbf2710b8863f3de4a7e0a,technology,2018-04-12 01:45:11.497061
Tristan Greene,The automation revolution is here and millions of human workers could be replaced by machines over the next decade. Most of us will adapt or find new positions. But new research indicates ...,2018-04-11T17:19:40Z,the-next-web,Robots will steal summer jobs and eradicate teen employment,https://thenextweb.com/artificial-intelligence/2018/04/11/robots-will-eradicate-teen-jobs/,https://cdn0.tnwcdn.com/wp-content/blogs.dir/1/files/2018/04/sadteen-social.jpg,technology,2018-04-12 01:45:11.497061
Neer Varshney,"It’s like the controversies surrounding Craig Wright — the self-proclaimed ‘Satoshi Nakamoto’ — are refusing to die out. Wright is currently facing allegations of plagiarism for referencing someone else’s work without proper citations. In his latest academic publication titled The fallacy of selfish mining in Bitcoin, the self-proclaimed Bitcoin creator purportedly borrowed mathematical equations from another […]",2018-04-11T16:54:48Z,the-next-web,Bitcoin ‘creator’ Craig Wright is facing accusations of plagiarism,https://thenextweb.com/hardfork/2018/04/11/bitcoin-craig-wright-plagiarism/,https://img-cdn.tnwcdn.com/image/hardfork?filter_last=1&fit=1280%2C640&url=https%3A%2F%2Fcdn0.tnwcdn.com%2Fwp-content%2Fblogs.dir%2F1%2Ffiles%2F2018%2F04%2Fwright.png&expires=17291459171&signature=78830c55c1e45c7f05c9ff7af311dd75,technology,2018-04-12 01:45:11.497061
Ailsa Sherrington,"15,000 CEOs, entrepreneurs and investors will descend on Amsterdam for TNW Conference this May. They’re not just coming for the A-list speakers and awesome networking – they’re ...",2018-04-11T14:30:34Z,the-next-web,Exhibit at TNW Conference for free - thanks to Startup League,https://thenextweb.com/insider/2018/04/11/exhibit-startup-free-tnw2018-thanks-startup-league/,https://cdn0.tnwcdn.com/wp-content/blogs.dir/1/files/2018/04/tnw-blogbanner_startup-796x398@2x-social.jpg,technology,2018-04-12 01:45:11.497061
