author,description,publishedAt,source,title,url,urlToImage,category,scraping_date
Dalvin Brown,"These adorable little animals ""bite"" onto your smartphone.",2018-04-11T20:41:18Z,mashable,Where to get those adorable Cable Bites that are flooding your Twitter feed,http://mashable.com/2018/04/11/where-to-get-cable-bites/,https://i.amz.mshcdn.com/_ogz8-LCJ9fyo7qcuOS6LWi9hVE=/1200x630/2018%2F04%2F11%2F60%2Fbbead2e3c1234344aceb2c079685a8d2.83641.png,entertainment,2018-04-12 01:45:11.497061
Chloe Bryan,Got a few hundo lying around?,2018-04-11T20:38:59Z,mashable,Feast Your Eyes On These Absurdly Expensive Sandwiches,http://mashable.com/2018/04/11/reels-absurdly-expensive-sandwiches/,https://i.amz.mshcdn.com/mqGtNBqaB3GlPqL1fdVxpLNTets=/1200x630/2018%2F04%2F11%2F1e%2F48d27c7401ce4a94ba1fa926b32418b9.875f9.jpg,entertainment,2018-04-12 01:45:11.497061
Ryan Sedmak,Since being diagnosed she has been in therapy and is taking medication.,2018-04-11T19:59:13Z,mashable,Mariah Carey reveals she is being treated with bipolar disorder,http://mashable.com/2018/04/11/mariah-carey-reveals-she-is-being-treated-with-bipolar/,https://i.amz.mshcdn.com/0indupuCuht_dytuTDGR6etQ9UE=/1200x630/2018%2F04%2F11%2F32%2F5c38f6f5f9a34bdb9fbda22a659f559c.888db.jpg,entertainment,2018-04-12 01:45:11.497061
Leah Stodart,The Instant Pot is not a kitchen device. It's a way of life.,2018-04-11T17:48:16Z,mashable,The Instant Pot is on sale on Amazon: Save $13 and join the hype train,http://mashable.com/2018/04/11/instant-pot-duo-on-sale-amazon/,https://i.amz.mshcdn.com/Xh2zDwKH4_vBm7tNjSdH24NWqgs=/1200x630/2018%2F04%2F11%2F13%2Fc799205b7b7e43e0b285c72fb3d89c22.053b0.png,entertainment,2018-04-12 01:45:11.497061
Carley Sposta,"Munch, munch, crunch, crunch!",2018-04-11T16:37:18Z,mashable,Never eat another bite of soggy cereal with this special bowl,http://mashable.com/2018/04/11/obol-cereal-bowl/,https://i.amz.mshcdn.com/qv1JVkB4RX3RaZD5cDuiQ9d238Y=/1200x630/2018%2F04%2F11%2Faf%2F79357955235a45d789c860fcef4ef4d8.699b3.jpg,entertainment,2018-04-12 01:45:11.497061
metrojoey,Britain could be ready to strike within 24 hours.,2018-04-11T21:02:32Z,metro,Theresa May ‘orders submarines to Syria as Britain prepares to strike’,http://metro.co.uk/2018/04/11/theresa-may-orders-submarines-syria-britain-prepares-strike-7459992/,http://metrouk2.files.wordpress.com/2018/04/sec_6956916.jpg?quality=80&strip=all&crop=0px%2C0px%2C1200px%2C630px&resize=1200%2C630,general,2018-04-12 01:45:11.497061
metrojoey,She said she is still suffering from the effects of the attack.,2018-04-11T19:34:54Z,metro,Yulia Skripal says her ‘life is totally different’ as she declines Russian help,http://metro.co.uk/2018/04/11/yulia-skripal-says-life-totally-different-declines-russian-help-7459883/,https://metrouk2.files.wordpress.com/2018/04/sei_6944841.jpg?quality=80&strip=all,general,2018-04-12 01:45:11.497061
tomherbert12345,Police are said to be standing guard over the 'shrine' put up for the burglar killed during a botched burglary.,2018-04-11T18:29:04Z,metro,Police 'threaten to arrest vigilantes removing Henry Vincent's flowers',http://metro.co.uk/2018/04/11/police-threaten-arrest-vigilantes-removing-henry-vincents-flowers-7459526/,http://metrouk2.files.wordpress.com/2018/04/sei_6909878-e1523469425827.jpg?quality=80&strip=all&crop=0px%2C46px%2C2350px%2C1235px&resize=1200%2C630,general,2018-04-12 01:45:11.497061
jimmymccloskey,Donald Trump issued a terrifying threat to Russian president Vladimir Putin on Twitter Wednesday. He threatened to fire missiles at Putin's forces in Syria after the Russian leader vowed to shoot down any US bombs launched in the county.,2018-04-11T11:12:30Z,metro,Donald Trump threatens to fire missiles at Vladimir Putin's troops in Syria,http://metro.co.uk/2018/04/11/donald-trump-threatens-fire-missiles-vladimir-putins-troops-syria-7458216/,http://metrouk2.files.wordpress.com/2018/04/tp1.jpg?quality=80&strip=all&crop=0px%2C13px%2C640px%2C336px&resize=1200%2C630,general,2018-04-12 01:45:11.497061
metrojoey,Police said the violent attack was a reminder of ‘the risks officers face every day’.,2018-04-11T22:04:02Z,metro,Moment police tazer man lashing out at officer with two knives,http://metro.co.uk/2018/04/11/moment-police-tazer-man-lashing-officer-two-knives-7459964/,https://metrouk2.files.wordpress.com/2018/04/untitled-1.gif,general,2018-04-12 01:45:11.497061
metrojoey,The packet of cheese and onion crisps just washed up on a Cornwall beach. A 10-year-old boy discovered the litter more than three times his age.,2018-04-11T15:11:13Z,metro,This 30-year-old Walkers packet shows just how destructive plastics can be,http://metro.co.uk/2018/04/11/30-year-old-walkers-packet-shows-just-destructive-plastics-can-7459145/,http://metrouk2.files.wordpress.com/2018/04/sec_6912171.jpg?quality=80&strip=all&crop=0px%2C0px%2C1200px%2C630px&resize=1200%2C630,general,2018-04-12 01:45:11.497061
jimmymccloskey,Stacy Sanchez faces life in prison after she was convicted of killing Jack Tenhulzen while driving home drunk from a nightclub. She left her victim to bleed to death after he crashed through her windscreen and lay wounded on her passenger seat.,2018-04-11T15:22:40Z,metro,Drunk driver hit man and kept driving after his body landed in passenger seat,http://metro.co.uk/2018/04/11/drunk-driver-hit-man-kept-driving-body-landed-passenger-seat-7459206/,https://metrouk2.files.wordpress.com/2018/04/car.jpg?quality=80&strip=all,general,2018-04-12 01:45:11.497061
metrojoey,"It didn't take before police found him. Well, he was wearing one of the stolen police hats.",2018-04-11T18:24:26Z,metro,"Man breaks into police station, takes a poo and leaves wearing uniform",http://metro.co.uk/2018/04/11/man-breaks-police-station-takes-poo-leaves-wearing-uniform-7459481/,http://metrouk2.files.wordpress.com/2018/04/poo_police_hat.png?crop=0px%2C0px%2C1200px%2C630px&resize=1200%2C630&quality=80&strip=all,general,2018-04-12 01:45:11.497061
Mel Evans,It comes after allegations of sexual misconduct.,2018-04-11T20:11:07Z,metro,LA County prosecutors 'reviewing sex crimes case against Kevin Spacey',http://metro.co.uk/2018/04/11/la-county-prosecutors-reviewing-sex-crimes-case-kevin-spacey-7459947/,https://metrouk2.files.wordpress.com/2018/04/sei_69503951.jpg?quality=80&strip=all&w=1200&h=630&crop=1,general,2018-04-12 01:45:11.497061
https://www.facebook.com/richardhartleyparkinson,The young couple were charged the exorbitant fee for a journey that took just nine minutes.,2018-04-11T06:42:10Z,metro,Rickshaw driver confronted 'for charging couple £150 for 1.5-mile ride',http://metro.co.uk/2018/04/11/rickshaw-driver-confronted-charging-couple-150-1-5-mile-ride-7457106/,http://metrouk2.files.wordpress.com/2018/04/sec_6853549.jpg?quality=80&strip=all&crop=0px%2C0px%2C1200px%2C630px&resize=1200%2C630,general,2018-04-12 01:45:11.497061
Sally Hind,"Reuben Fenton's battle to survive meant doctors were able to save his twin Arloe - this is their remarkable, yet tragic, story",2018-04-12T04:58:16Z,mirror,Premature tot fought 'to the last' to be born so his twin brother could live,https://www.mirror.co.uk/news/uk-news/premature-tot-fought-to-very-12348771,https://i2-prod.mirror.co.uk/incoming/article12348757.ece/ALTERNATES/s1200/FMF_SDR_11042018TWINS3JPG.jpg,general,2018-04-12 01:45:11.497061
Lucy Needham,Khloe and Lamar were together between 2009 and 2013 - and the basketball star admitted to cheating throughout their marriage,2018-04-11T21:50:41Z,mirror,Lamar Odom breaks silence over ex-wife Khloe Kardashian's latest heartbreak,https://www.mirror.co.uk/3am/celebrity-news/lamar-odom-feels-terrible-khloe-12347913,https://i2-prod.mirror.co.uk/incoming/article4663706.ece/ALTERNATES/s1200/Lemar-and-Khloe.jpg,general,2018-04-12 01:45:11.497061
Martin Fricker,"Referencing Aston Villa's Jack Grealish, the royal told fans: “I’m going to insist the baby is called Jack,” before adding after a pause “... or Jackie”",2018-04-11T21:17:25Z,mirror,Prince William drops huge hint about gender of royal baby with name clue,https://www.mirror.co.uk/sport/football/news/prince-william-drops-huge-hint-12345342,https://i2-prod.mirror.co.uk/incoming/article12347954.ece/ALTERNATES/s1200/h_01154340.jpg,general,2018-04-12 01:45:11.497061
Mirror.co.uk,"The actress enjoyed a well-deserved break with her husband, 30-year-old personal trainer, Tom Pitford and her three-year-old son, Alfie",2018-04-11T19:20:53Z,mirror,Catherine Tyldesley soaks up the sun in bikini during Abu Dhabi family holiday,https://www.mirror.co.uk/3am/celebrity-news/catherine-tyldesley-soaks-up-sun-12345731,https://i2-prod.mirror.co.uk/incoming/article12345509.ece/ALTERNATES/s1200/EMB-PAY-JS148568183ed.jpg,general,2018-04-12 01:45:11.497061
Alex Richards,"The Italian great was sent off late on as Juventus were dumped out of the Champions League, despite an astonishing fightback",2018-04-11T22:45:58Z,mirror,Buffon blasts referee Oliver after Juventus' Champions League dream crushed,https://www.mirror.co.uk/sport/football/news/gianluigi-buffon-blasts-referee-michael-12348358,https://i2-prod.mirror.co.uk/incoming/article12348423.ece/ALTERNATES/s1200/Champions-League-Quarter-Final-Second-Leg-Real-Madrid-vs-Juventus.jpg,general,2018-04-12 01:45:11.497061
"Andrew Gregory, Dan Bloom","The threat of of war looms as Russia sends troops to Douma, Trump warns ""get ready"" for missiles and Theresa May says ""all indications"" point to the Syrian regime. Jeremy Corbyn demanded MPs get a vote on military action",2018-04-11T20:24:00Z,mirror,British submarines 'ordered to move within missile range of Syria',https://www.mirror.co.uk/news/politics/world-braces-war-russia-triggers-12344867,https://i2-prod.mirror.co.uk/incoming/article12338754.ece/ALTERNATES/s1200/Victims-of-poisonous-gas-attack-in-Eastern-Ghouta-Syriaed.jpg,general,2018-04-12 01:45:11.497061
Laura Elvin,Qualified teachers Luke Burns and wife Olga thought they would be in a hotel for just one week after being turfed out of a flood-damaged flat they rented privately,2018-04-11T15:59:46Z,mirror,Family forced to live in Premier Inn for 3 years due to council house blunders,https://www.mirror.co.uk/news/uk-news/family-wins-compo-after-being-12343003,https://i2-prod.mirror.co.uk/incoming/article12343294.ece/ALTERNATES/s1200/EMB-SWNS_HOTEL_STAY_010jpg1.jpg,general,2018-04-12 01:45:11.497061
"Natalie Evans, Jamie Bullen","The sun, moon, and planet Jupiter will align in the constellation of Virgo on April 23 to bring about the 'Rapture' - the belief that Christ will resurrect again",2018-04-12T03:58:22Z,mirror,Conspiracy theorist believes the Rapture and Nibiru will end the world in days,https://www.mirror.co.uk/news/world-news/conspiracy-theorist-predicts-world-end-12348343,https://i2-prod.mirror.co.uk/incoming/article11644124.ece/ALTERNATES/s1200/Planets-in-space.jpg,general,2018-04-12 01:45:11.497061
Kelly-Ann Mills,WARNING - GRAPHIC CONTENT: The randy pair didn't seem to care who saw them as they romped away at Caterham station in Surrey,2018-04-12T01:02:08Z,mirror,Brazen couple filmed having sex on train in front of gobsmacked onlookers,https://www.mirror.co.uk/news/uk-news/brazen-couple-filmed-having-sex-12348060,https://i2-prod.mirror.co.uk/incoming/article12348319.ece/ALTERNATES/s1200/Brazen-couple-filmed-having-sex-on-train-while-carriage-is-sat-at-platform.jpg,general,2018-04-12 01:45:11.497061
Steve Robson,Police in Toronto are looking at cases as far back as 1975 in connection with Bruce McArthur,2018-04-12T03:06:35Z,mirror,'Gay serial killer' charged with seventh killing as police probe 15 more cases,https://www.mirror.co.uk/news/world-news/gay-serial-killer-bruce-mcarthur-12348740,https://i2-prod.mirror.co.uk/incoming/article12348739.ece/ALTERNATES/s1200/Gay-serial-killer-Bruce-McArthur-charged-with-seventh-killing-as-police-to-probe-FIFTEEN-more-cold.jpg,general,2018-04-12 01:45:11.497061
Crystal Bell,"Louis Hynes on Season 2, 'taking risks,' and improvising alongside Neil Patrick Harris",2018-04-11T13:49:39Z,mtv-news,"For Young A Series Of Unfortunate Events Star, 'You Can't Just Wait For An Adult To Do Something'",http://www.mtv.com/news/3072858/louis-hynes-a-series-of-unfortunate-events-interview/,https://imagesmtv-a.akamaihd.net/uri/mgid:ao:image:mtv.com:647061?quality=0.8&format=jpg&width=1440&height=810&.jpg,entertainment,2018-04-12 01:45:11.497061
Alissa Schulman,She's a weed-smoking high schooler living her best life with her best friends,2018-04-12T00:53:23Z,mtv-news,Lucy Hale Sheds Her Good Girl Image In First Dude Trailer,http://www.mtv.com/news/3073364/lucy-hale-netflix-dude-trailer/,https://imagesmtv-a.akamaihd.net/uri/mgid:ao:image:mtv.com:647480?quality=0.8&format=jpg&width=1440&height=810&.jpg,entertainment,2018-04-12 01:45:11.497061
Madeline Roth,Looks like she's pulling out all the stops for her Reputation trek,2018-04-11T21:06:09Z,mtv-news,Taylor Swift’s New Tour Rehearsal Pics Hint At Lots Of Dancing Ahead,http://www.mtv.com/news/3073340/taylor-swift-reputation-tour-rehearsal-pics-dancers/,https://imagesmtv-a.akamaihd.net/uri/mgid:ao:image:mtv.com:647449?quality=0.8&format=jpg&width=1440&height=810&.jpg,entertainment,2018-04-12 01:45:11.497061
Charles Holmes,Bodak Romance,2018-04-11T20:55:19Z,mtv-news,Cardi B Reflects On Covering Lady Gaga And Madonna At Her High School Talent Shows,http://www.mtv.com/news/3073289/cardi-b-lady-gaga-madonna-high-school/,https://imagesmtv-a.akamaihd.net/uri/mgid:ao:image:mtv.com:647407?quality=0.8&format=jpg&width=1440&height=810&.jpg,entertainment,2018-04-12 01:45:11.497061
Alissa Schulman,Or so the villain thinks...,2018-04-11T00:50:54Z,mtv-news,Avengers: Infinity War Directors Reveal Thanos Really Is Working For The Greater Good,http://www.mtv.com/news/3073223/avengers-infinity-war-thanos-motivation/,https://imagesmtv-a.akamaihd.net/uri/mgid:ao:image:mtv.com:647329?quality=0.8&format=jpg&width=1440&height=810&.jpg,entertainment,2018-04-12 01:45:11.497061
Rachel Davies-Day,We're just gonna go ahead and take this as confirmation that the Riverdale stars are dating.,2018-04-04T10:41:54Z,mtv-news-uk,Riverdale's Cole Sprouse And Lili Reinhart Spotted Sharing An Adorable Kiss In Paris,http://www.mtv.co.uk/cole-sprouse/news/riverdales-cole-sprouse-and-lili-reinhart-caught-kissing-in-paris,http://www.mtv.co.uk/sites/default/files/styles/carousel_wide/public/mtv_uk/galleries/large/2018/04/04/nav.jpg?itok=HrVtbtPU,entertainment,2018-04-12 01:45:11.497061
Rachel Davies-Day,Reddit well and truly came through.,2018-04-04T10:00:20Z,mtv-news-uk,An Autistic Teen Asked For Sex Ed On Reddit And The People Supplied All The Answers,http://www.mtv.co.uk/life/news/an-autistic-teen-asked-for-sex-ed-on-reddit-and-the-people-supplied-all-the-answers,http://www.mtv.co.uk/sites/default/files/styles/carousel_wide/public/mtv_uk/galleries/large/2018/04/04/sex.jpg?itok=vAp15ARW,entertainment,2018-04-12 01:45:11.497061
MTV News,The Ex On The Beach lass has absolutely no time for false stories.,2018-04-03T10:34:56Z,mtv-news-uk,Marnie Simpson Had The Best Response To A Man Who Claimed He’d Slept With Her,http://www.mtv.co.uk/marnie-simpson/news/marnie-simpson-had-the-best-response-to-a-man-who-claimed-hed-slept-with-her,http://www.mtv.co.uk/sites/default/files/styles/carousel_wide/public/mtv_uk/galleries/large/2018/04/03/marnithough.gif?itok=rfSwHHpZ,entertainment,2018-04-12 01:45:11.497061
MTV News,"The beauty vlogger described their interaction as ""a really crappy experience.""",2018-04-03T11:31:26Z,mtv-news-uk,Fans Defend Ariana Grande After YouTuber James Charles Brands Her ‘Rude’,http://www.mtv.co.uk/ariana-grande/news/fans-defend-ariana-grande-after-youtuber-james-charles-brands-her-rude,http://www.mtv.co.uk/sites/default/files/styles/carousel_wide/public/mtv_uk/galleries/large/2018/04/03/ariananav.jpg?itok=2cO2W3Bd,entertainment,2018-04-12 01:45:11.497061
Sam Wong,A personalised cancer vaccine that trains the immune system to attack tumours has had encouraging results in women with ovarian cancer,2018-04-11T00:00:00Z,new-scientist,Ovarian cancer vaccine improves women’s survival rates,https://www.newscientist.com/article/2166101-ovarian-cancer-vaccine-improves-womens-survival-rates/,https://d1o50x50snmhul.cloudfront.net/wp-content/uploads/2018/04/11143744/m8500247-sem_of_ovarian_cancer_cells-spl.jpg,science,2018-04-12 01:45:11.497061
Leah Crane,"Random number generators are key to data encryption, but it’s impossible to prove that most truly work. A new one uses quantum laws to guarantee randomness",2018-04-11T00:00:00Z,new-scientist,Encrypt your data with random quantum weirdness,https://www.newscientist.com/article/2166096-encrypt-your-data-with-random-quantum-weirdness/,https://d1o50x50snmhul.cloudfront.net/wp-content/uploads/2018/04/11143437/gettyimages-771494663.jpg,science,2018-04-12 01:45:11.497061
Alice Klein,"When sexual selection leads to extreme differences between sexes like the peacock's tail, it makes species more likely go extinct",2018-04-11T00:00:00Z,new-scientist,Species with big sex differences are more likely to die out,https://www.newscientist.com/article/2166068-species-with-big-sex-differences-are-more-likely-to-die-out/,https://d1o50x50snmhul.cloudfront.net/wp-content/uploads/2018/04/11163318/gettyimages-579246887.jpg,science,2018-04-12 01:45:11.497061
Leah Crane,"The US is making noises about increasingly militarising space, but orbital conflict won’t be a battle of spaceships and bombs",2018-04-11T00:00:00Z,new-scientist,"War in space may happen soon, but it won’t be what you expect",https://www.newscientist.com/article/mg23831730-200-war-in-space-may-happen-soon-but-it-wont-be-what-you-expect/,https://d1o50x50snmhul.cloudfront.net/wp-content/uploads/2018/04/09122130/m3x357.jpg,science,2018-04-12 01:45:11.497061
Jonathan Berman,"A global rally against the denigration of science was a huge event in 2017. The need for a repeat this weekend is strong, says Jonathan Berman",2018-04-11T00:00:00Z,new-scientist,Science fans have many reasons to take to the streets again,https://www.newscientist.com/article/mg23831732-700-science-fans-have-many-reasons-to-take-to-the-streets-again/,https://d1o50x50snmhul.cloudfront.net/wp-content/uploads/2018/04/10143723/new-scientist-14.4.18.jpg,science,2018-04-12 01:45:11.497061
Penny Sarchet,Half of all meetings start late – and your boss is probably to blame. A study found that meetings delayed just 10 minutes are likely to be less productive,2018-04-11T00:00:00Z,new-scientist,Your boss is probably to blame for meetings starting late,https://www.newscientist.com/article/2166151-your-boss-is-probably-to-blame-for-meetings-starting-late/,https://d1o50x50snmhul.cloudfront.net/wp-content/uploads/2018/04/11165617/p312m1229402.jpg,science,2018-04-12 01:45:11.497061
Richard Kemeny,"Facebook has built an AI fashion designer that is intended to be truly creative. It has designed more than 1000 handbags, jumpers and T-shirts",2018-04-11T00:00:00Z,new-scientist,Need a new look? Facebook’s AI fashion designer has some ideas,https://www.newscientist.com/article/mg23831733-800-need-a-new-look-facebooks-ai-fashion-designer-has-some-ideas/,https://d1o50x50snmhul.cloudfront.net/wp-content/uploads/2018/04/11152131/1804.jpg,science,2018-04-12 01:45:11.497061
Lucas Joel,Sediment deposits reveal when the longest river in the world started flowing from Ethiopia to the Mediterranean,2018-04-11T00:00:00Z,new-scientist,The Nile river is at least 30 million years old,https://www.newscientist.com/article/mg23831733-700-the-nile-river-is-at-least-30-million-years-old/,https://d1o50x50snmhul.cloudfront.net/wp-content/uploads/2018/04/11150955/01122101-1.jpg,science,2018-04-12 01:45:11.497061
New Scientist staff and Press Association,The US Senate questioned Mark Zuckerberg yesterday about Cambridge Analytica. He said Facebook will investigate thousands of other apps for similar misuse,2018-04-11T00:00:00Z,new-scientist,Facebook to examine tens of thousands of apps for data misuse,https://www.newscientist.com/article/2166059-facebook-to-examine-tens-of-thousands-of-apps-for-data-misuse/,https://d1o50x50snmhul.cloudfront.net/wp-content/uploads/2018/04/11112017/gettyimages-944384250.jpg,science,2018-04-12 01:45:11.497061
New Scientist staff and Press Association,A six-year study of nearly half a million people in the UK has found that people who were night owls were 10 per cent more likely to die during that time period,2018-04-12T00:00:00Z,new-scientist,Struggle to get up in the morning? You’re at risk of early death,https://www.newscientist.com/article/2166161-struggle-to-get-up-in-the-morning-youre-at-risk-of-early-death/,https://d1o50x50snmhul.cloudfront.net/wp-content/uploads/2018/04/11175340/gettyimages-694035107.jpg,science,2018-04-12 01:45:11.497061
https://www.facebook.com/ShaolinTomReporter,"""We hope the Trump administration thinks twice before deciding to attack Syria,"" the ruling Chinese Communist Party's newspaper said.",2018-04-11T22:05:05Z,newsweek,"China says Trump should give Assad ""an opportunity to explain"" before attacking",http://www.newsweek.com/china-says-us-should-give-syria-assad-opportunity-explain-trump-attacks-882445,http://s.newsweek.com/sites/www.newsweek.com/files/styles/full/public/2018/04/11/rts1o7s0_0.jpg,general,2018-04-12 01:45:11.497061
Max Kutner,The Trump-supporting sisters claim the social network is censoring their content.,2018-04-11T21:32:07Z,newsweek,"Diamond and Silk hit back at Mark Zuckerberg, Facebook ‘censorship’: ‘We are not terrorists’",http://www.newsweek.com/diamond-and-silk-facebook-zuckerberg-882332,http://s.newsweek.com/sites/www.newsweek.com/files/styles/full/public/2018/04/11/0411diamondsilkfacebook.jpg,general,2018-04-12 01:45:11.497061
https://www.facebook.com/ShaolinTomReporter,Defense Secretary James Mattis is heading to the White House to show President Donald Trump his options for attacking Syria.,2018-04-11T20:27:44Z,newsweek,"U.S. military is ""ready"" to show Trump how to attack Syria, even if Russia fights back",http://www.newsweek.com/us-military-ready-show-trump-plans-attack-syria-russia-says-fight-back-882284,http://s.newsweek.com/sites/www.newsweek.com/files/styles/full/public/2018/04/11/rtx5mjoa_0.jpg,general,2018-04-12 01:45:11.497061
Tom Roddy,City let a two-goal lead slip in the Manchester derby on Saturday (April 7).,2018-04-09T11:57:19Z,newsweek,It’s now Tottenham’s turn to spoil the title party for Manchester City,http://www.newsweek.com/tottenham-vs-manchester-city-spurs-turn-ruin-title-celebrations-pep-guardiola-876716,http://s.newsweek.com/sites/www.newsweek.com/files/styles/full/public/2018/04/09/pep-guardiola.jpg,general,2018-04-12 01:45:11.497061
https://www.facebook.com/CristinaLeeMaza/,A judge determined that the far-right ideologue incited crimes against humanity with a speech.,2018-04-11T20:20:47Z,newsweek,Far-right politician says he's proud of crimes against humanity and is ready to repeat them,http://www.newsweek.com/far-right-politician-says-hes-proud-crimes-against-humanity-and-ready-repeat-882214,http://s.newsweek.com/sites/www.newsweek.com/files/styles/full/public/2018/04/11/image-590110182_0.jpg,general,2018-04-12 01:45:11.497061
Gillian Edevane,The revelation paints a different picture than the gun rights group's previous disclosures.,2018-04-11T20:31:45Z,newsweek,NRA admits accepting money from 23 Russia-Linked donors,http://www.newsweek.com/nra-admits-accepting-money-23-russia-linked-donors-882310,http://s.newsweek.com/sites/www.newsweek.com/files/styles/full/public/2018/04/11/gettyimages-644206880.jpg,general,2018-04-12 01:45:11.497061
Michael Edison Hayden,"Eight months after the deadly Unite the Right rally descended into chaos, the identities of white nationalists involved in violent incidents remain unknown.",2018-04-11T20:23:26Z,newsweek,Violent Charlottesville white nationalists sought by civil rights group eight months after deadly rally,http://www.newsweek.com/charlottesville-white-nationalists-rally-violent-882090,http://s.newsweek.com/sites/www.newsweek.com/files/styles/full/public/2018/04/11/rts1biim.jpg,general,2018-04-12 01:45:11.497061
Jason Le Miere,It is not the first time the veteran White House reporter said she had received death threats during the Trump administration.,2018-04-11T20:59:55Z,newsweek,"April Ryan asked if Trump had considered resigning, then his supporters sent her death threats",http://www.newsweek.com/trump-resign-april-ryan-death-threats-882382,http://s.newsweek.com/sites/www.newsweek.com/files/styles/full/public/2018/04/11/gettyimages-677827976.jpg,general,2018-04-12 01:45:11.497061
Jonathan Chait@jonathanchait,Requiem for the face and brain of the Republican Party.,2018-04-11T15:46:26.08Z,new-york-magazine,"Fanatic, Fraud, Factotum: The Rise and Fall of Paul Ryan",http://nymag.com/daily/intelligencer/2018/04/fanatic-fraud-factotum-the-rise-and-fall-of-paul-ryan.html,https://pixel.nymag.com/imgs/daily/intelligencer/2018/04/11/11-paul-ryan-trump.w1200.h630.jpg,general,2018-04-12 01:45:11.497061
Gabriel Debenedetti,"“McConnell has said, ‘the House is lost, we have to hold the Senate,’” says a Republican operative.",2018-04-11T21:52:23.996Z,new-york-magazine,"After Ryan’s Exit, Big-Money Donors Turn to War for Senate",http://nymag.com/daily/intelligencer/2018/04/after-ryans-exit-big-money-donors-turn-to-war-for-senate.html,https://pixel.nymag.com/imgs/daily/intelligencer/2018/04/11/11-pelosi-schumer.w1200.h630.jpg,general,2018-04-12 01:45:11.497061
